,Hotel Names,Rating,Stars,Location,Center Distance,Price,Description
443,Anais Apartments by Gaiarooms,"7,7",3,Eixample,0.6,2.022,"Anais Apartments by Gaiarooms ofrece alojamiento con aire acondicionado en el centro de Barcelona, a 3 km de Platja del Somorrostro, a 3 km de Platja de Sant Miquel y a 3 min a pie de Estación de metro Passeig de Gràcia. Hay wifi gratis en todo el alojamiento.

El apartamento ofrece balcón, vistas a la ciudad, zona de estar, TV de pantalla plana, cocina totalmente equipada con nevera y microondas, y baño privado con ducha y artículos de aseo gratuitos. También se ofrece fogones y tostadora, además de cafetera y hervidor.

Cerca del alojamiento hay puntos de interés como Casa Batlló, Paseo de Gracia y Teatro Tívoli. El aeropuerto (Aeropuerto de Barcelona - El Prat) está a 13 km."
444,Amister Apartments,"8,8",4,Eixample,0.3,2.882,"El Amister Apartments está situado en el centro de Barcelona, ​​a 300 metros de la plaza de Catalunya, y ofrece apartamentos de 1 dormitorio con conexión WiFi gratuita.

Todos los apartamentos del Amister tienen una cocina totalmente equipada, con horno y lavavajillas, que da a un salón comedor con sofá y TV de pantalla plana. También hay una lavadora y se proporcionan productos de limpieza.

En las calles de los alrededores, los huéspedes encontrarán tiendas, bares y sitios para comer.

Los autobuses con destino al aeropuerto paran de forma regular a solo 250 metros."
445,You Stylish Beach Apartments,"7,7",3,Sant Martí,4.2,4.431,"Estos apartamentos son elegantes y algunos tienen vistas al mar Mediterráneo y WiFi gratuita.

Los apartamentos del You Stylish Beach son luminosos y están decorados en tonos claros. Cuentan con aire acondicionado, baño privado, cocina totalmente equipada, zona de comedor con balcón y La sala de estar incluye TV de pantalla plana y reproductor de DVD.

Algunos apartamentos tienen acceso a una terraza y piscina exterior compartida.

La avenida Diagonal y la estación de metro Selva de Mar están a menos de 600 metros de los apartamentos. El histórico Barrio Gótico de Barcelona está a solo 6 paradas de metro."
446,Beautiful apartment in Las Ramblas Barcelona 6pax,"7,7",3,Ciutat Vella,1.2,2.838,"Beautiful apartment in Las Ramblas Barcelona 6pax es un alojamiento con una ubicación excelente en el centro de Barcelona que ofrece balcón. Hay wifi gratis y se ofrece parking privado por un suplemento.

Este apartamento de 3 dormitorios tiene aire acondicionado y ofrece 2 baños con ducha. Hay toallas y ropa de cama en el apartamento.

Se puede practicar senderismo y ciclismo en los alrededores.

Cerca del alojamiento hay puntos de interés como Santa María del Mar, Museo Picasso y Plaza Real. El aeropuerto (Aeropuerto de Barcelona - El Prat) está a 11 km."
447,Hostal Rio De Castro,"8,3",2,Sants,1.6,1.046,"El Hostal Rio de Castro se encuentra en el centro de Barcelona, en la avenida del Paralelo, ​​junto a la estación de metro Poble Sec, y ofrece WiFi gratuita. El alojamiento está situado a 10 minutos a pie de la Fuente Mágica de Montjuïc.

Todas las habitaciones incluyen aire acondicionado, TV de pantalla plana, suelo de baldosa y escritorio, y algunas tienen baño privado con secador de pelo y artículos de aseo.

También alberga una zona común con salón de TV, microondas y cafetera. En las inmediaciones hay numerosos restaurantes, bares y tiendas.

Asimismo, se proporciona consigna de equipaje. El Rio de Castro se halla a 15 minutos a pie de Las Ramblas atravesando el barrio de El Raval."
448,Housalia Sagrada Familia,"7,8",3,Eixample,1.7,1.588,"Featuring free Wi-Fi and roof fans, there is NO AIR CONDITIONING.
It is on the first floor and there is NO LIFT.

Housalia Sagrada Familia is located within 5 minutes’ walk of Sagrada Familia and Plaza Gaudí Park. Set in Barcelona’s centre, these modern apartments offer a ticket service and tour desk.

Offering stylish and colourful décor, the apartments include a living-dining room with a flat-screen TV. The kitchenette is equipped with a washing machine and oven, and the bathroom comes with a bathtub. Towels as well as bed linen are provided.

Please check the excluded costs for cleaning fee and tourist tax: they are separate from the total rent amount, but clearly displayed before confirming the final payment. Housalia Sagrada Familia is centrally located and there is a wide range of shops, bars and Catalan restaurants within a 10-minute walk. Sagrada Familia and Sant Pau metro stations are within the same distance.

Arc de Triomf Train Station is 3 km from the property, as well as Port Olimpic and the Mediterranean beaches. Barcelona Airport is 15 km away."
449,Hotel Casa Fuster G.L Monumento,"9,0",5,Gracia,1.6,4.042,"Este edificio modernista se encuentra al principio del elegante Paseo de Gracia de Barcelona. Cuenta con una sauna, gimnasio y terraza en la azotea con piscina y excelentes vistas.

La lujosa Casa Fuster es un monumento en sí mismo. El edificio los construyó en 1908 el arquitecto modernista Lluis Domènech i Montaner y cuenta con categoría de monumento. Su obra, incluyendo el hotel, ha sido declarada Patrimonio de la Humanidad por la UNESCO.

Las elegantes habitaciones del Casa Fuster G.L Monumento cuentan con aire acondicionado, TV por satélite y un minibar. El baño privado está equipado con secador de pelo, albornoz y zapatillas. Algunas habitaciones tienen bañera de hidromasaje.

El Casa Fuster Hotel dispone de un elegante restaurante, que sirve cocina mediterránea. El servicio de habitaciones está disponible y hay un bar de jazz y un bar chill-out en la azotea.

Se ofrece servicio de conserjería y recepción 24 horas. Podrá alquilar un coche en el mostrador de información turística y podrá aparcar en el aparcamiento de las inmediaciones por un suplemento."
450,Victoria City Center Barcelona,"9,3",4,Eixample,0.1,4.610,"El Victoria City Center Barcelona es un apartamento dúplex de 5 dormitorios situado en la esquina de la plaza Catalunya y el Paseo de Gracia. Este elegante establecimiento cuenta con aire acondicionado y balcón.

Dispone de conexión WiFi gratuita, 1 dormitorio doble, 4 dormitorios con 2 camas individuales cada uno y 2 baños con secador de pelo. La cocina está bien equipada e incluye lavavajillas, horno, lavadora y cafetera. La sala de estar cuenta con sofá y TV de pantalla plana. También incluye secadora de ropa.

El Victoria City Center Barcelona está a 300 metros del famoso bulevar de La Rambla. En el paseo de Gracia hay una gran variedad de bares, restaurantes y tiendas de diseño, así como los famosos edificios de La Pedrera y la Casa Batlló de Gaudí.

El aeropuerto de Barcelona El Prat se encuentra a 13 km del establecimiento y se ofrece servicio de enlace con el aeropuerto por un suplemento. La estación de tren y metro de Catalunya está a 50 metros del apartamento."
451,"Las Ramblas, comfort in BCN for 8 persons","8,0",3,Ciutat Vella,1.2,3.763,"Las Ramblas, comfort in BCN for 8 persons es un alojamiento con una ubicación ideal en el centro de Barcelona que ofrece balcón, aire acondicionado, wifi gratis y TV de pantalla plana. Este apartamento está a 2,3 km de Platja de la Barceloneta y a 2,3 km de Platja de Sant Sebastià.

El apartamento dispone de 4 dormitorios, cocina con nevera, lavadora y 3 baños con secador de pelo. Hay toallas y ropa de cama en el apartamento.

Cerca del alojamiento hay puntos de interés como Santa María del Mar, Museo Picasso y Plaza Real. El aeropuerto (Aeropuerto de Barcelona - El Prat) está a 11 km."
452,Sant Jordi Apartments Sagrada Familia,"7,8",3,Sant Martí,2.6,2.366,"Sant Jordi Apartments Sagrada Familia cuenta con vistas a la ciudad y se encuentra en el barrio de Sant Martí, en Barcelona, a 11 min a pie de Sagrada Familia y a 2,6 km de La Pedrera. Se ofrece wifi gratis en todo el alojamiento y parking privado en el propio alojamiento.

Cada unidad está equipada con aire acondicionado, baño privado y cocina con nevera, horno, microondas y fogones. Hay una zona de estar y de comedor en todas las unidades.

El apartamento ofrece desayuno buffet o continental.

Sant Jordi Apartments Sagrada Familia ofrece servicio de alquiler de bicicletas.

Paseo de Gracia está a 3,1 km del alojamiento, y Casa Batlló está a 3,1 km. El aeropuerto (Aeropuerto de Barcelona - El Prat) está a 16 km."
453,Stay Barcelona Charming Gracia,"8,0",3,Gracia,2.4,1.577,"Stay Barcelona Charming Gracia está en Barcelona, a 16 min a pie de Paseo de Gracia y a 1,7 km de La Pedrera, y ofrece wifi gratis y aire acondicionado. Este apartamento está a 2,4 km de Casa Batlló y a 14 min a pie de Parque Güell.

El apartamento tiene balcón, 1 dormitorio, sala de estar y cocina bien equipada con nevera y lavavajillas. Hay toallas y ropa de cama en el apartamento.

Sagrada Familia está a 1,9 km del alojamiento, y Estación de metro Passeig de Gràcia está a 2,9 km. El aeropuerto (Aeropuerto de Barcelona - El Prat) está a 16 km."
454,"Ally's Bed&Breakfast,","8,1",2,Eixample,1.2,1.822,"El Ally’s Guest House está situado a 300 metros de La Pedrera y a 600 metros de la Sagrada Familia. Hay WiFi gratuita en todas las instalaciones.

Las habitaciones del Ally’s Guest House Barcelona son cómodas y luminosas. Todas tienen calefacción y aire acondicionado, y la mayoría cuenta con baño privado.

El salón del Ally’s Guest House cuenta con TV, reproductor de DVD, ordenador e impresora. En la zona de salón comedor hay microondas y nevera.

La estación de metro Verdaguer está a 200 metros y el centro de Barcelona, a 2 paradas de metro. El Ally’s se halla a pocos pasos de la Diagonal y del paseo de Gràcia, las zonas comerciales principales de la ciudad. La plaza de Cataluña y la Casa Batlló también se encuentran a un breve paseo.

Consulte el horario del registro de entrada en el apartado de información útil."
455,Aspasios Poble Nou Apartments,"8,3",3,Sant Martí,2.6,2.055,"Aspasios Poble Nou Apartments se encuentra en Barcelona, cerca de Platja del Bogatell, Platja de la Nova Icària, y Playa de la Mar Bella. Dispone de wifi gratis, piscina al aire libre y terraza.

El alojamiento tiene aire acondicionado, cocina totalmente equipada y con zona de comedor, TV de pantalla plana y baño privado con bañera o ducha, artículos de aseo gratuitos y secador de pelo. También se ofrece nevera, horno y microondas, además de cafetera y hervidor.

Platja del Somorrostro está a 2,1 km del alojamiento, y Platja de la Barceloneta está a 2,6 km. El aeropuerto (Aeropuerto de Barcelona - El Prat) está a 16 km."
456,Chic & Basic Tallers Hostal,"7,1",3,Ciutat Vella,0.5,1.072,"Este establecimiento de moda se encuentra en la animada zona del Raval y es el punto de partida ideal para explorar el centro de la ciudad y los lugares de ocio nocturno de la zona.

El Chic & Basic Tallers Hostal presenta una decoración moderna y elegante y cuenta con mucha luz natural. En la zona Chill&Basic del establecimiento se puede disfrutar de café gratuito o preparar un bocadillo mientras se escucha música relajante.

El establecimiento está a poca distancia a pie de la mayoría de monumentos de la ciudad, como los impresionantes edificios de Gaudí Casa Batlló y La Pedrera, situados en el paseo de Gracia."
457,1208 - EXCLUSIVE DESIGN APARTMENT,"8,1",4,Eixample,0.45,3.285,"1208 - EXCLUSIVE DESIGN APARTMENT es un alojamiento con una ubicación ideal en el centro de Barcelona que ofrece balcón. Este apartamento ofrece wifi gratis y una cocina totalmente equipada.

Este apartamento con aire acondicionado consta de 2 dormitorios y 2 baños con ducha, bañera y secador de pelo. Hay toallas y ropa de cama en el apartamento.

Cerca del alojamiento hay puntos de interés como Palacio de la Música Catalana, Teatro Tívoli y Estación de metro Passeig de Gràcia. El aeropuerto (Aeropuerto de Barcelona - El Prat) está a 13 km."
458,BUHO Boutique Rooms,"8,3",3,Eixample,0.45,1.193,"El BUHO Boutique Barcelona, situado a solo 500 metros de la plaza de Cataluña y de Las Ramblas, ofrece habitaciones con encanto equipadas con aire acondicionado y decoradas de forma individual con mobiliario de época. Hay WiFi gratuito en todas las instalaciones.

Las habitaciones están decoradas con obras de arte y disponen de ventanales, TV de pantalla plana, reproductor de DVD y varios DVD. El baño privado incluye secador de pelo y artículos de aseo gratuitos. Algunas habitaciones tienen acceso a una terraza con encanto compartida.

El BUHO Boutique Barcelona cuenta con sala de TV. Hay restaurantes y bares en los alrededores.

El personal proporciona información turística. La catedral de Barcelona y la Casa Batlló de Gaudí están a menos de 10 minutos a pie.

Los autobuses en dirección al aeropuerto salen de la plaza de Cataluña. Hay consigna de equipaje."
459,Monument Hotel,"9,1",5,Eixample,1.0,3.560,"El Monument Hotel se encuentra en el moderno Paseo de Gracia, a 5 minutos a pie de la Casa Batlló y La Pedrera, y ofrece un restaurante gourmet y un spa.

Todas las habitaciones están insonorizadas, presentan una decoración elegante y disponen de TV de pantalla plana con canales de pago, sistema de sonido por Bluetooth y caja fuerte con enchufe para cargar dispositivos portátiles. La mayoría de las habitaciones tiene baño privado con bañera de pie, albornoz de terciopelo y artículos de aseo de lujo, y balcón con vistas a la ciudad.

El restaurante Lasarte, con 3 estrellas Michelin, prepara una selección de platos creados por el chef Martín Berasategui. El restaurante de estilo bistró del establecimiento, el Oria, sirve cocina mediterránea con ingredientes frescos.

El Monument Hotel se halla a 10 minutos a pie de la plaza Catalunya y Las Ramblas, y a 300 metros de la estación de tren de Paseo de Gracia, desde donde salen trenes regulares con destino al aeropuerto de Barcelona-El Prat. Se proporciona WiFi gratuita de alta velocidad.

El hotel ocupa la Casa Enric Batlló, una joya arquitectónica protegida del siglo XIX."
460,Villa Modernista,"9,6",4,Horta,3.6,6.525,"Villa Modernista se encuentra en Barcelona, a 2,9 km de Sagrada Familia y a 3,7 km de Parque Güell, y ofrece alojamiento con wifi gratis, aire acondicionado, piscina de temporada al aire libre y jardín. Esta villa también dispone de piscina privada.

La villa cuenta con 4 dormitorios, 2 baños, ropa de cama, toallas, TV de pantalla plana con canales vía satélite, zona de comedor, cocina totalmente equipada y terraza con vistas a la piscina.

La villa ofrece barbacoa.

Paseo de Gracia está a 4,1 km del alojamiento, y La Pedrera está a 4,2 km. El aeropuerto (Aeropuerto de Barcelona - El Prat) está a 17 km."
461,Arenas Atiram Hotels,"8,5",4,Les Corts,3.7,1.034,"El hotel Arenas se encuentra en Barcelona, a 200 metros de las numerosas tiendas y restaurantes de la avenida Diagonal, y ofrece habitaciones modernas con TV y reproductor de DVD.

Cada mañana se sirve un desayuno buffet en el restaurante del hotel.

Hay un aparcamiento público a 3 minutos del hotel.

El Arenas Atiram está a 15 minutos a pie del estadio de fútbol Camp Nou. La estación de metro María Cristina se halla a 200 metros y el centro comercial L’Illa, a 10 minutos a pie."
462,Picasso Suites,"8,7",4,Eixample,1.0,2.451,"El Picasso Suites está situado en el barrio del Eixample de Barcelona y cuenta con una azotea compartida, amueblada y con vistas a la ciudad. El establecimiento ofrece apartamentos con conexión Wi-Fi gratuita y aire acondicionado.

Los apartamentos disponen de sala de estar con sofá, TV de pantalla plana vía satélite y reproductor de DVD. Además, cuentan con cocina con horno, microondas y cafetera. El baño incluye secador de pelo.

El Mercado de la Concepción está junto a los apartamentos. Además, en los alrededores hay una gran variedad de supermercados, bares y restaurantes. El alojamiento ofrece servicios por un suplemento entre los que se incluyen: servicio de niñera, alquiler de coche, aparcamiento privado y transporte al aeropuerto.

La Plaza de Cataluña y la Sagrada Familia de Gaudí están a 15 minutos a pie del alojamiento. La estación de metro Girona, con enlace al barrio Gótico y a la playa de la Barcelona, se encuentra a solo 300 metros."
463,Montaber Apartments - Sagrada Familia,"8,6",3,Eixample,2.1,1.990,"Montaber Apartments - Sagrada Familia está en Barcelona, a 2,5 km de Platja de la Nova Icària y a 2,8 km de Platja del Bogatell, y ofrece alojamiento con wifi gratis, zona de estar y TV de pantalla plana.

Cada unidad está equipada con aire acondicionado, baño privado y cocina con nevera, lavavajillas, horno y microondas. También hay fogones y tostadora, además de cafetera y hervidor.

Sagrada Familia está a 6 min a pie del alojamiento, y Casa Batlló está a 2,2 km. El aeropuerto (Aeropuerto de Barcelona - El Prat) está a 15 km."
464,Apartments Barcelona & Home Deco Eixample,"9,2",4,Eixample,1.5,2.472,"El Apartments Barcelona & Home Deco ofrece apartamentos elegantes en el barrio del Eixample, a menos de 10 minutos a pie de Las Ramblas y de la Plaza de Catalunya. Los alojamientos son elegantes y cuentan con conexión Wi-Fi gratuita.

Los apartamentos del establecimiento Barcelona & Home Deco están situados en la Rambla de Catalunya, la calle Balmes o la calle d'Aragó, y presentan una decoración elegante, con bonitos acabados. La amplia zona de estar dispone de TV, mientras que la cocina está equipada con microondas, nevera, horno, tostadora y cafetera.

Los huéspedes encontrarán paradas de transporte público, tiendas, bares y restaurantes a lo largo de la Rambla de Catalunya, en el Passeig de Gràcia y en los alrededores de la Plaza de Catalunya.

El establecimiento se encuentra cerca de lugares de interés como la Casa Batlló de Gaudí y a poca distancie a pie o en metro del Barrio Gótico y del Barrio del Born."
465,Glocal Apartments Barcelona,"8,7",4,Eixample,1.6,2.658,"El Glocal Apartments Barcelona ofrece apartamentos elegantes y modernos a 280 metros de la avenida Diagonal y a 10 minutos a pie del Paseo de Gracia. Hay conexión Wi-Fi gratuita.

Todos los apartamentos de Glocal Apartments Barcelona son luminosos y cuentan con aire acondicionado, sala de estar con TV de pantalla plana y una cocina totalmente equipada con lavavajillas. También incluyen lavadora, ropa de cama y toallas. Los baños disponen de ducha.

Hay numerosos restaurantes y bares en la zona, además de varias paradas de autobús. La estación de metro más cercana es la de Hospital Clinic, ubicada a 6 minutos a pie.

La encantadora avenida de la Rambla de Cataluña, con sus árboles y tiendas, se encuentra a 8 minutos a pie del establecimiento. Un paseo de 20 minutos por la Rambla lleva a la Plaza de Cataluña, en pleno centro de Barcelona."
466,Evenia Rossello,"8,3",4,Eixample,1.3,1.505,"El Evenia Rossello tiene una ubicación excelente, a sólo 5 minutos a pie del elegante bulevar Paseo de Gracia. Ofrece habitaciones modernas con suelos de madera, conexión gratuita a internet y un gimnasio.

El moderno restaurante L'Illa del Rosselló sirve cocina mediterránea. También se podrá disfrutar de las típicas tapas en la terraza Placeta Joan Brossa, la cual está rodeada de pequeños jardines.

El mostrador de información turística del Evenia Rossello puede proporcionarle información útil sobre la ciudad y ayudarle con el alquiler de coches. También se proporciona guardaequipaje.

La estación de metro Diagonal está a 400 metros del hotel y ofrece acceso directo al centro de la ciudad de Barcelona. El aeropuerto de Barcelona está a 12 km."
467,LetsGo Paseo de Gracia,"8,3",4,Eixample,0.15,3.554,"El Apartament Paseo de Gracia ofrece alojamiento independiente con conexión Wi-Fi gratuita. Se encuentra en el centro de Barcelona, a 40 metros de Plaza Catalunya y a 5 minutos a pie de La Rambla de la ciudad.

Los apartamentos con modernos y presentan una decoración elegante. Disponen de 1 o 2 dormitorios y baño con secador de pelo y artículos de aseo gratuitos. La zona de estar tiene TV de pantalla plana vía satélite y sofás. La cocina está equipada con microondas, lavadora y lavavajillas. Algunos tienen terraza.

Gracias a su ubicación céntrica, encontrará muchos bares, restaurantes y supermercados en los alrededores.

El Apartament Paseo de Gracia está a 2,5 km de la Sagrada Familia y de la Plaza Catalunya, desde donde parten los autobuses que llevan al aeropuerto de Barcelona. La playa de la Barceloneta se halla a 25 minutos a pie."
468,Ciudad Condal Hostal - Paseo de Gracia,"7,7",3,Eixample,1.0,893,"El Hostal Ciudad Condal - Paseo de Gracia ofrece un alojamiento situado en el barrio de la ciudad de Barcelona. Las habitaciones se distribuyen por la planta principal de una casa con una arquitectura catalogada en el patrimonio municipal como el conjunto de Casas Àngel Batlló de la calle Mallorca, 255, entre el famoso paseo de Gracia y la animada Rambla de Cataluña.

Todas las habitaciones disponen de aire acondicionado, calefacción, baño privado, ventana, TV de pantalla plana, escritorio, caja fuerte, baúl, secador de pelo, artículos de aseo básicos y WiFi gratuita. Debido a las características arquitectónicas del edificio, todas las habitaciones son diferentes. Cada una de ellas presenta un diseño sencillo y funcional que se adapta al espacio.

El establecimiento ofrece habitaciones individuales, dobles, dobles superiores y triples, así como suites y habitaciones familiares con capacidad para un máximo de 4 personas. Algunos alojamientos tienen balcón con vistas a la calle o a los famosos jardines interiores del conjunto arquitectónico del Ensanche de Barcelona (plan Cerdà). Otras habitaciones son interiores.

En el paseo de Gracia y en la zona de Gracia hay muchas cafeterías y restaurantes.

El establecimiento se encuentra a unos 200 metros de la Casa Batlló y La Pedrera (obras de Gaudí). La estación de metro Diagonal está a 5 minutos a pie. La plaza de Cataluña y Las Ramblas se encuentran a solo 2 paradas de metro."
469,Blue Barcelona,"8,1",,Sarrià,2.1,1.773,"El Blue Barcelona, situado en el distrito barcelonés de Gracia, junto a la estación de FGC de Gracia, ofrece conexión WiFi gratuita, salón compartido y mostrador de información turística.

Las habitaciones tienen aire acondicionado, TV de pantalla plana con canales vía satélite, escritorio y suelo de madera. Algunas disponen de baño privado con ducha o bañera y artículos de aseo gratuitos, mientras que otras cuentan con acceso a un baño compartido.

El Blue Barcelona se encuentra a 5 minutos a pie de varios bares, restaurantes y tiendas. También hay máquinas expendedoras.

La estación de metro de Fontana se halla a 300 metros, la Plaza Catalunya y Las Ramblas quedan a 2 paradas de metro y la Sagrada Familia de Gaudí está a 2,3 km"
470,Som Nit Born,"8,3",3,Ciutat Vella,1.3,1.429,"El Som Nit Born cuenta con aire acondicionado y conexión Wi-Fi gratuita. Se encuentra en el barrio barcelonés del Born, a solo 10 minutos a pie de la playa de la Barceloneta y a 500 metros del Museo Picasso.

Las habitaciones del Som Nit Born están insonorizadas e incluyen TV de pantalla plana y un baño privado con ducha. El establecimiento también ofrece una caja fuerte y consigna de equipaje gratuita.

A 1 minuto a pie encontrará los numerosos bares y restaurantes del barrio del Born.

Picasso vivió en este edificio neoclásico del siglo XIX, que además aparece en la 1ª fotografía que fue tomada en España.

El Som Nit está en el centro de Barcelona, a 10 minutos a pie de La Rambla, el Port Vell y el Barrio Gótico. También se encuentra a 200 metros del autobús turístico y a 2 minutos a pie de la estación de metro de Barceloneta."
471,Ferran Pedralbes Penthouse,"8,8",4,Les Corts,3.9,4.530,"Ferran Pedralbes Penthouse está en Barcelona, a 1,7 km de Camp Nou y a 2,9 km de Estación de tren de Sants, y ofrece wifi gratis y aire acondicionado. El alojamiento ofrece vistas a la montaña y está a 3,7 km de Fuente Mágica de Montjuïc y a 3,8 km de Paseo de Gracia.

El apartamento tiene 3 dormitorios, 2 baños, ropa de cama, toallas, TV de pantalla plana, zona de comedor, cocina totalmente equipada y terraza con vistas a la ciudad. Para mayor comodidad, el alojamiento puede ofrecer toallas y ropa de cama por un suplemento.

La recepción ofrece ayuda de forma ininterrumpida, y el personal habla catalán, inglés, español y francés.

La Pedrera está a 4 km del alojamiento, y Casa Batlló está a 4,2 km. El aeropuerto (Aeropuerto de Barcelona - El Prat) está a 12 km, y el alojamiento ofrece servicio de traslado de pago para ir o volver del aeropuerto."
472,Flateli Navas A01,"8,4",4,Sant Andreu,3.7,1.827,"Flateli Navas A01 se encuentra en el barrio de Sant Andreu, en Barcelona, a 2,3 km de Sagrada Familia y a 3,6 km de La Pedrera, y ofrece alojamiento equipado con balcón y wifi gratis. Este apartamento está a 3,9 km de Paseo de Gracia y a 4 km de Casa Batlló.

Este apartamento con aire acondicionado se compone de 2 dormitorios independientes, una cocina totalmente equipada con nevera y lavavajillas, y 1 baño. Hay toallas y ropa de cama en el apartamento.

Estación de metro Passeig de Gràcia está a 4,5 km del alojamiento, y Teatro Tívoli está a 4,6 km. El aeropuerto más cercano (Aeropuerto de Barcelona - El Prat) está a 17 km del alojamiento."
