,Hotel Names,Rating,Stars,Location,Center Distance,Price,Description
219,Generator Barcelona,"7,7",1,Gracia,1.5,1.153,"El Generator Barcelona se encuentra a 500 metros de la moderna avenida Paseo de Gracia. Este albergue cuenta con recepción 24 horas, WiFi gratuita en las zonas comunes y habitaciones compartidas con taquillas privadas de uso gratuito.

El Generator Barcelona se halla a unos 5 minutos a pie de las estaciones de metro Diagonal y Verdaguer. El barrio de Gracia, situado a solo 200 metros, alberga numerosas boutiques y bares.

Tanto las habitaciones privadas como las habitaciones compartidas disponen de aire acondicionado y calefacción, así como tomas de corriente individuales y puntos de lectura individuales en cada cama. Las habitaciones compartidas solo para mujeres incluyen secador de pelo y otras comodidades.

El baño privado tiene lavabo y espejo. La ropa de cama está incluida. Las toallas pueden alquilarse en la recepción. Solo los huéspedes mayores de 18 años pueden alojarse en las habitaciones compartidas.

Se sirve un desayuno diario por un suplemento. El Generator Barcelona también cuenta con salón común y consigna de equipaje."
220,Bcn - Poble Nou,"7,1",,Sant Martí,3.2,1.342,"Bcn - Poble Nou está en Barcelona, a 8 min a pie de Playa de la Mar Bella y a 800 metros de Platja del Bogatell, y ofrece wifi gratis y aire acondicionado. Este apartamento está a 12 min a pie de Platja de la Nova Mar Bella y a 2,5 km de Port Olimpic.

El apartamento tiene 2 dormitorios, una cocina totalmente equipada con nevera y horno, y 1 baño con ducha y secador de pelo. Hay TV.

Sagrada Familia está a 3,4 km del alojamiento, y Santa María del Mar está a 3,7 km. El aeropuerto (Aeropuerto de Barcelona - El Prat) está a 15 km."
221,Hostal Marenostrum,"8,3",2,Ciutat Vella,0.7,1.182,"Este establecimiento goza de una ubicación inmejorable en la emblemática Rambla y frente al teatro Liceu. Ofrece conexión gratuita a internet y un desayuno buffet.

El personal de la recepción del Marenostrum ofrece información turística. En los alrededores de la Rambla encontrará numerosos lugares de interés, como el animado mercado de la Boquería y la catedral.

Podrá pasear por la Rambla hasta la plaza de Cataluña viendo a los artistas callejeros y curioseando en los puestos de la calle. También podrá visitar las playas de Barcelona, situadas a poca distancia a pie.

Los alojamientos del Hostal Marenostrum están insonorizados y son funcionales y cómodos. Disponen de aire acondicionado, calefacción y baño con secador de pelo. Hay recepción 24 horas."
222,Hotel Acta Azul Barcelona,"8,3",3,Sants,2.5,1.454,"El Hotel Acta Azul Barcelona, ubicado junto a la plaza de España y a los pies de Montjuïc, ofrece un alojamiento elegante en el centro de Barcelona. Cuenta con terraza en la azotea, recepción 24 horas y WiFi gratuita.

Podrá llegar en metro a Las Ramblas y al Barrio Gótico de la ciudad en menos de 10 minutos. Allí encontrará diversos bares y restaurantes.

Las habitaciones del Azul son amplias, presentan una decoración muy colorida y tienen suelo de madera. Todas cuentan con aire acondicionado, TV vía satélite y escritorio.

El hotel se encuentra a 5 minutos a pie del centro de conferencias Fira de Barcelona y de la Fuente Mágica de la plaza de España. El parque de Montjuïc y el museo MNAC están a 1 km del hotel. Las Arenas, una plaza de toros convertida en centro comercial, está al lado."
223,Hotel Market,"7,6",3,Eixample,1.2,1.677,"El Hotel Market se encuentra en Barcelona, junto al mercado de San Antonio y ​​a 10 minutos a pie del Museo de Arte Contemporáneo MACBA. El establecimiento ofrece habitaciones elegantes con ducha de efecto lluvia y WiFi gratuita. También alberga un restaurante muy frecuentado.

Las habitaciones del Market Hotel presentan una decoración moderna y constan de vigas de madera oscura, paredes blancas y ventanas grandes. Todas las habitaciones incluyen baño privado. Algunas habitaciones cuentan con balcón o terraza.

El establecimiento se halla a 15 minutos a pie de la plaza de España y de la plaza Catalunya. Asimismo, el hotel está ubicado a unos 200 metros de la estación de metro Sant Antoni y a solo 2 minutos a pie de la parada del autobús que proporciona conexiones con el aeropuerto.

El restaurante del Market Hotel está especializado en platos de arroz y sirve una selección de platos de la cocina catalana moderna en un ambiente elegante."
224,Upper Diagonal,"8,8",4,Sarrià,4.0,1.653,"El Upper Diagonal se encuentra en el barrio barcelonés de Pedralbes y ​​ofrece alojamiento moderno con WiFi gratis y gimnasio a solo 1 km del Camp Nou.

Todas las habitaciones incluyen TV de pantalla plana y baño privado con artículos de aseo gratuitos y secador de pelo. Se ofrecen utensilios de planchado.

El hotel alberga un restaurante de cocina de temporada. Los huéspedes también podrán visitar otras tiendas y restaurantes en la avenida Diagonal, a solo 600 metros, y en el centro comercial L’Illa Diagonal.

El establecimiento cuenta con recepción 24 horas y servicio de alquiler de coches.

La Pedrera está a 3,3 km del Upper Diagonal, mientras que el Tibidabo se encuentra a 3,4 km. El aeropuerto de El Prat es el más cercano y está a 11 km del Upper Diagonal."
225,Catalonia Ramblas 4* Sup,"8,5",4,Ciutat Vella,0.3,1.808,"El Catalonia Ramblas 4* Sup está ubicado en Barcelona, junto a la famosa zona de Las Ramblas y a 3 minutos a pie de la céntrica plaza de Cataluña, y ofrece piscina de temporada al aire libre con terraza orientada al sur, bar cafetería junto a la piscina y zona de chill-out.

Las habitaciones, amplias y luminosas, se hallan en un edificio modernista. Disponen de WiFi gratuita, set de té/café y Smart TV de pantalla plana con canales vía satélite y la aplicación Chromecast. Algunos alojamientos tienen terraza privada con piscina. Hay servicio de habitaciones.

El spa del Catalonia Ramblas 4* Sup cuenta con zona de relajación. Hay sauna, baño de vapor y bañera de hidromasaje. También se ofrecen tratamientos de belleza y un servicio de masajes.

El restaurante Pelai del hotel sirve platos catalanes elaborados según el concepto de cocina de mercado. Los platos se elaboran en una cocina de carbón y pueden tomarse en la terraza Pelai, situada en la azotea y que cuenta con una zona de chill-out con vistas panorámicas a la ciudad. El desayuno buffet se sirve todos los días. Los fines de semana, está disponible hasta las 11:00.

En verano, la terraza está abierta hasta las 00:00 y ofrece una carta veraniega, además de cócteles y batidos."
226,Hostal Boutique Khronos,"8,6",2,Eixample,1.1,1.428,"El Hostal Boutique Khronos está a 450 metros de la famosa Pedrera y del Paseo de Gracia de Barcelona. Dispone de terraza en la azotea y proporciona conexión Wi-Fi gratuita en todas sus instalaciones.

Las habitaciones del Khronos Boutique son sencillas y elegantes. Disfrutan de vistas a la ciudad y cuentan con TV de pantalla plana, aire acondicionado, caja fuerte y baño moderno con secador de pelo y artículos de aseo. También se proporciona servicio de habitaciones durante todo el día.

La recepción ofrece toallas de playa, sombrillas y prensa. El Khronos tiene un mostrador de información turística que facilita información de la ciudad.

El ​​Khronos está situado en el distrito del Eixample de Barcelona, a 600 metros de la estación de metro de Diagonal y a solo 2 paradas de metro de las Ramblas y la Sagrada Familia de Gaudí."
227,Uma Suites Sagrada Familia,"8,7",4,Eixample,1.8,1.328,"Uma Suites Sagrada Familia se encuentra en Barcelona, cerca de Sagrada Familia, Casa Batlló, y Paseo de Gracia. Dispone de wifi gratis y terraza.

El alojamiento tiene aire acondicionado, cocina totalmente equipada, TV de pantalla plana y baño privado con ducha, artículos de aseo gratuitos y secador de pelo. También se ofrece nevera, horno y microondas, además de cafetera y hervidor.

Platja de la Nova Icària está a 2,7 km del alojamiento, y Platja del Somorrostro está a 3 km. El aeropuerto (Aeropuerto de Barcelona - El Prat) está a 15 km."
228,H10 Urquinaona Plaza,"8,7",4,Eixample,0.3,1.608,"El H10 Urquinaona Plaza se encuentra a 5 minutos a pie de la plaza de Cataluña y Las Ramblas y ofrece una terraza en la azotea con una pequeña piscina de temporada. Está situado junto a la estación de metro de Urquinaona.

El H10 Urquinaona Plaza ocupa un edificio reformado del siglo XIX y presenta una decoración moderna y refinada. Las elegantes habitaciones ofrecen un diseño minimalista y cuentan con WiFi gratuita, cafetera Nespresso, aire acondicionado y TV de pantalla plana.

Este H10 también dispone de restaurante, bar, salón con biblioteca y una terraza en la azotea con vistas fantásticas a la ciudad.

El hotel se encuentra a poca distancia a pie del Palau de la Música Catalana y a menos de 1 km del pintoresco barrio de El Born. La estación de metro y tren de Catalunya y la parada del autobús que conecta con el aeropuerto se encuentran a menos de 5 minutos a pie."
229,SmartRoom Barcelona,"8,5",,Sants,3.2,904,"El hotel ecológico SmartRoom es económico y está ubicado en el centro de Barcelona, a 1 km de la estación de tren de Barcelona-Sants. Cada habitación presenta una decoración moderna y cuenta con Smart TV de pantalla plana con canales vía satélite. Este hotel ha sido galardonado con la etiqueta Green Key por ser sostenible y respetuoso con el medioambiente.

Las habitaciones disponen de aire acondicionado y WiFi gratuita. El baño privado incluye ducha y artículos de aseo gratuitos. También hay escritorio y ropa de cama.

Se sirve un desayuno buffet a diario. El establecimiento cuenta con una máquina expendedora de bebidas y aperitivos. La recepción del SmartRoom Barcelona está disponible las 24 horas.

El SmartRoom Barcelona se encuentra a 450 metros de la plaza de Sants y a 15 minutos a pie de la estación de tren de Barcelona-Sants. El hotel está a 1,5 km del estadio Camp Nou y de la Fuente Mágica de Montjuic. El aeropuerto de Barcelona-El Prat queda a 20 minutos en coche."
230,Praktik Rambla,"8,5",3,Eixample,0.4,1.347,"Situado en la céntrica y arbolada Rambla Catalunya, este hotel boutique ocupa un palacete espectacular del siglo XIX. Conserva elementos originales tales como las columnas barrocas y los coloridos suelos de mosaico.

Las elegantes habitaciones del Praktik Rambla presentan un diseño minimalista y disponen de aire acondicionado. También incluyen Wi-Fi gratuita y un cuarto de baño privado, decorado con azulejos verdes muy llamativos.

El hotel ofrece una terraza con cómodos sofás para la relajación de sus huéspedes. De junio a septiembre, el hotel obsequia a sus clientes con zumo de frutas en la terraza, todas las tardes de 16:00 a 20:00.

La estación de metro de Passeig de Gracia está a 200 metros del Praktik Rambla. Sitios tan conocidos de Barcelona como la plaza Catalunya o Las Ramblas quedan a 5 minutos a pie. El hotel está rodeado de restaurantes, bares y tiendas."
231,Senator Barcelona Apartments,"7,5",3,Sarrià,2.6,1.312,"Los Apartamentos Senator Barcelona están situados en la Vía Augusta, en una agradable zona residencial, a 2 minutos a pie de la estación de tren de Muntaner. Incluye aire acondicionado, calefacción y conexión wifi gratuita en las habitaciones del hotel.

Todos los apartamentos disponen de TV, teléfono y baño privado con bañera o ducha. Los apartamentos también incluyen una zona de cocina equipada.

Un viaje en tren de 6 minutos te llevará a Plaza Cataluña y al centro de la ciudad de Barcelona. La catedral de la Sagrada Familia está a 3,3 km."
232,ibis Styles Barcelona Centre,"8,5",2,Eixample,1.2,1.127,"Ibis Styles Barcelona Centre está muy bien situado en el barrio de Eixample, Barcelona, a 5 min a pie de La Pedrera, a 900 metros de Casa Batlló y a 13 min a pie de Estación de metro Passeig de Gràcia. Este hotel de 2 estrellas ofrece bar y habitaciones con aire acondicionado, wifi gratis y baño privado. El alojamiento está a 6 min a pie de Paseo de Gracia y a 1,3 km del centro de la ciudad.

Las unidades de este alojamiento están equipadas con TV de pantalla plana con canales vía satélite y caja fuerte. En el hotel, las habitaciones disponen de ropa de cama y toallas.

Ibis Styles Barcelona Centre ofrece desayuno buffet o continental.

El personal habla catalán, alemán, inglés y español, y estará encantado de dar consejos sobre la zona en recepción.

Cerca del alojamiento hay puntos de interés como Teatro Tívoli, Sagrada Familia y Palacio de la Música Catalana. El aeropuerto (Aeropuerto de Barcelona - El Prat) está a 14 km."
233,BruStar Gotic-Centric,"7,5",2,Eixample,0.9,1.081,"El BruStarr Gotic está situado justo enfrente del Arco de Triunfo y ofrece habitaciones en el centro de Barcelona. Está a 10 minutos a pie de la Plaza Cataluña y de La Rambla.

Las habitaciones disponen de TV grande de pantalla plana, caja fuerte y baño privado con secador de pelo. Algunas habitaciones tienen balcón.

En las inmediaciones del BruStar Gotic-Centric se pueden encontrar numerosos sitios para comer, bares y tiendas.

Además, la estación de metro de Arco de Triunfo queda a 100 metros y cerca del alojamiento hay varias paradas de autobús."
234,Arya Stadium Hotel,"8,3",3,Sants,4.0,1.409,"Arya Stadium Hotel está en Barcelona, a 15 min a pie de Camp Nou, y dispone de alojamiento con piscina de temporada al aire libre, parking privado, jardín y terraza. Este hotel de 3 estrellas ofrece restaurante y tiene habitaciones con aire acondicionado, wifi gratis y baño privado. El alojamiento ofrece servicio de habitaciones, servicio de conserjería y servicio de organización de tours.

En el hotel, todas las habitaciones incluyen escritorio y TV de pantalla plana. Las habitaciones disponen de caja fuerte, algunas ofrecen balcón y otras también cuentan con vistas a la ciudad. En Arya Stadium Hotel, las habitaciones cuentan con ropa de cama y toallas.

En el alojamiento se sirve un desayuno buffet.

El personal de la recepción 24 horas habla catalán, inglés, español y francés, y estará encantado de ayudar.

Estación de tren de Sants está a 1,8 km del alojamiento, y Fuente Mágica de Montjuïc está a 3,3 km. El aeropuerto (Aeropuerto de Barcelona - El Prat) está a 11 km, y el alojamiento ofrece servicio de traslado de pago para ir o volver del aeropuerto."
235,B&B Boutique Ca La Maria,"9,1",4,Eixample,1.4,1.501,"El Ca La Maria Barcelona está situado en el centro de Barcelona, junto a la Rambla de Catalunya, y ofrece habitaciones en un apartamento elegante con conexión Wi-Fi gratuita y aire acondicionado.

Las habitaciones presentan una decoración moderna con techos altos y disponen de TV de pantalla plana y baño privado con ducha. Algunas de ellas también incluyen una bañera.

El establecimiento sirve un desayuno buffet y cuenta con solárium amplio de madera, jardín, zona cubierta con mesa de comedor, salón común grande y bar con bebidas y aperitivos.

El bed & breakfast se encuentra a solo 5 minutos a pie del edificio de la Pedrera de Gaudí, en una zona con muchos bares y restaurantes, a 300 metros de la estación de metro Diagonal y a 2 paradas de metro de la plaza Catalunya."
236,Royal Ramblas,"8,3",4,Ciutat Vella,0.3,1.833,"El Royal Ramblas está ubicado en las famosas Ramblas de Barcelona, a 100 metros de la plaza Catalunya. Ofrece habitaciones elegantes y modernas con aire acondicionado, TV de plasma, WiFi gratuita y aparcamiento privado. Algunas habitaciones tienen vistas magníficas a las Ramblas.

El hotel alberga una sala de reuniones con vistas excepcionales a las Ramblas.

El restaurante La Poma sirve un desayuno buffet con varios productos regionales y bollería casera. Tiene vistas impresionantes a las Ramblas y ofrece comida mediterránea.

El Royal Ramblas Hotel está muy bien ubicado. Tiene acceso a todos los servicios de transporte público y se halla a 5 minutos a pie del elegante paseo de Gracia, que cuenta con numerosos restaurantes y tiendas exclusivas. El centro histórico queda a poca distancia a pie, así como el mercado de La Boquería y el MACBA (Museo de Arte Contemporáneo de Barcelona). La playa está a 20 minutos.

El personal del mostrador de información turística del Royal Ramblas Barcelona ofrece información práctica sobre la ciudad y presta un servicio de alquiler de coches. También gestiona el servicio de enlace con el aeropuerto."
237,Violeta Boutique,"9,0",2,Eixample,0.4,1.637,"Este establecimiento boutique se encuentra en el elegante barrio barcelonés del Eixample, a 300 metros de la plaza Catalunya. También está a 200 metros de la estación de metro de Urquinaona y dispone de habitaciones con aire acondicionado, la mayoría con balcón.

Las habitaciones del Violeta Boutique están ubicadas en un edificio reformado del siglo XIX y presentan una decoración de estilo contemporáneo. Además, todas ofrecen vistas a la ciudad y disponen de conexión WiFi gratuita, TV de plasma y baño privado amplio.

Los huéspedes podrán relajarse en la terraza del establecimiento o visitar los bares, tiendas y restaurantes situados a menos de 5 minutos a pie. Las Ramblas se encuentran a solo 7 minutos también a pie.

El Violeta Boutique está a 250 metros de las exclusivas tiendas y monumentos de Gaudí del Paseo de Gracia, mientras que el Palau de la Musica Catalana y la zona bohemia del Born se encuentran a 5 minutos a pie. La estación de autobuses Estació del Nord y el parque de la Ciutadella también están a 15 minutos a pie."
238,Fisa Rentals Ramblas Apartments,"8,7",4,Eixample,0.3,1.591,"El Fisa Rentals Ramblas Apartments se encuentra en el centro de Barcelona, ​​a sólo 250 metros de la plaza Catalunya y de las Ramblas. Dispone de apartamentos elegantes con aire acondicionado, conexión Wi-Fi gratuita y TV de pantalla plana vía satélite.

Los apartamentos del Fisa Rentals presentan una decoración moderna y cuentan con suelo de parqué, reproductor de DVD y cocina con placa eléctrica, microondas, lavadora y lavavajillas.

La Casa Batlló y La Pedrera de Gaudí están a unos 15 minutos a pie de los apartamentos, mientras que el mercado de La Boquería y el espectacular Palau de la Música Catalana se encuentran a menos de 10 minutos también a pie. Los autobuses hacia el aeropuerto salen de la plaza Catalunya."
239,Catalonia Square 4* Sup,"8,9",4,Eixample,0.2,1.948,"El Catalonia Square, que dispone de piscina al aire libre y centro de fitness, está situado en el centro histórico de Barcelona. Este hotel de 4 estrellas está a solo 100 metros de la plaza Catalunya y proporciona WiFi gratuita.

Todas las habitaciones presentan una decoración moderna con suelo de madera, aire acondicionado, TV de pantalla plana vía satélite, minibar y cargador de batería para el iPhone/iPad. Incluyen baño privado con secador de pelo, artículos de aseo gratuitos y toallas Algunas habitaciones tienen piscina privada y terraza.

El bar del Catalonia Square sirve bebidas, aperitivos y tapas tradicionales. El desayuno se sirve hasta las 12:00. Se proporciona servicio de habitaciones.

La Rambla y el Barrio Gótico están a sólo 5 minutos a pie del hotel. Las estaciones de metro de Passeig de Gràcia, Plaça Catalunya y Urquinaona se encuentran a menos de 300 metros y conectan con la mayoría de las zonas de Barcelona.

Todas las habitaciones del hotel tienen Smart TV con Chromecast."
240,Lovely apartment with a terrace,"8,1",3,Eixample,1.2,1.302,"Lovely apartment with a terrace se encuentra en Barcelona, a 15 min a pie de Casa Batlló y a 1,4 km de Paseo de Gracia, y ofrece wifi gratis y aire acondicionado. Este apartamento se encuentra en un edificio de 1920 y está a 18 min a pie de Plaza Cataluña y a 1,5 km de Estación de metro Passeig de Gràcia.

El apartamento cuenta con terraza y vistas a la ciudad, y dispone de 1 dormitorio, una sala de estar, TV de pantalla plana, una cocina equipada con nevera y horno, y 1 baño con ducha.

Cerca del alojamiento hay puntos de interés como Estación de tren de Sants, Fuente Mágica de Montjuïc y Teatro Tívoli. El aeropuerto (Aeropuerto de Barcelona - El Prat) está a 12 km."
241,Ola Living Hostal Diagonal,"7,0",3,Sarrià,1.9,1.368,"El Ola Living Hostal Diagonal se encuentra en Barcelona y ofrece WiFi gratuita. El hotel se encuentra a 800 metros del paseo de Gracia, famoso por sus tiendas de lujo, y ofrece habitaciones modernas con aire acondicionado.

Las habitaciones presentan una decoración moderna e incluyen calefacción, 1 cama doble o 2 camas individuales, TV de pantalla plana y armario. El baño es privado e incluye ducha y secador de pelo. Algunas habitaciones también incluyen una bañera de hidromasaje. Todas están en la planta baja.

El hotel ofrece una zona de salón.

A 5 minutos a pie del Ola Living Hostal Diagonal Exclusive rooms hay varios restaurantes, bares y tiendas de alimentación. La estación de metro de Diagonal está a 850 metros del establecimiento, y la plaza Catalunya se halla a 2 paradas.

La recepción se encuentra en el 228 de la calle Aribau. Abre de lunes a domingo en horario de 09:00 a 20:00.

El registro de entrada se realiza a las 15:00. Si llega antes, podrá dejar su equipaje en recepción hasta que su apartamento esté listo. También después del registro de salida (11:00) se puede dejar el equipaje en la recepción.

El apartamento se abre a través de un smartphone. Si necesita hacer el registro de entrada en persona después de las 21:00, Este servicio conlleva un suplemento de 30 EUR."
242,Ilunion Almirante,"7,5",4,Ciutat Vella,0.5,1.436,"Este hotel elegante se encuentra entre el Barrio Gótico y el barrio de moda de El Born y cuenta con centro de fitness y WiFi gratuita en todas las instalaciones.

El Ilunion Almirante queda a 200 metros de la catedral de Barcelona, a 10 minutos a pie de las famosas Ramblas y a 300 metros de la estación de metro Jaume I.

Las habitaciones disponen de mobiliario de madera, baño privado con acabados de mármol, TV de pantalla plana grande con canales vía satélite, caja fuerte y minibar.

Este hotel cuenta con un certificado oficial por sus instalaciones para personas con movilidad reducida. Ofrece habitaciones adaptadas para personas con discapacidad, entre ellas visual o auditiva.

El Ilunion Almirante alberga una elegante sala de desayunos donde se sirve un desayuno a la carta cada día. El servicio de habitaciones está disponible en horario limitado.

Este hotel está adaptado para personas con movilidad reducida."
243,Hostal Nova Barcelona,"8,6",3,Sants,3.7,1.150,"El Hostal Nova Barcelona ofrece alojamiento en Barcelona. El establecimiento queda a 1 km de la estación de tren de Sants. Al lado del alojamiento paran los autobuses V3 y 115.

Las habitaciones están equipadas con TV de pantalla plana y baño privado. Además, tienen secador de pelo y artículos de aseo gratuitos.

La recepción está abierta las 24 horas.

Este albergue presta servicio de alquiler de coches y bicicletas. El centro comercial Gran Vía 2 está a 1,1 km y el puerto de Barcelona Fuel De pot queda a 3,9 km. El aeropuerto más cercano es el aeropuerto de El Prat, a 9 km. Los autobuses de línea regular salen de una parada de autobús situada a solo 200 metros."
244,Sunotel Aston,"7,5",3,Eixample,1.9,1.370,"El Sunotel Aston se encuentra a 3 minutos a pie de la estación de metro de Hospital Clínic y ofrece una terraza en la azotea con piscina de temporada, bañera de hidromasaje y vistas panorámicas a Barcelona.

Las habitaciones cuentan con aire acondicionado, TV de pantalla plana, ventanas insonorizadas y baño privado con secador de pelo. Hay WiFi gratuita de alta velocidad.

El hotel sirve un desayuno bufé abundante. El restaurante Pa'l Caldero del hotel ofrece una amplia selección de platos de todo el mundo. Además, en las inmediaciones encontrará muchos sitios para comer. 

La recepción del Sunotel Aston está abierta las 24 horas y se ofrecen varios servicios como consigna de equipaje, toallas gratuitas para la piscina y bicicletas gratuitas.

La plaza de Catalunya y las Ramblas se encuentran a unos 15 minutos en transporte público, mientras que la famosa catedral de la Sagrada Familia de Barcelona está a unos 10 minutos."
245,Catalonia Portal de l'Angel,"8,7",3,Ciutat Vella,0.3,1.692,"Este hotel ocupa un edificio tradicional del siglo XIX y está ubicado entre la plaza de Cataluña y el Barrio Gótico de Barcelona. Ofrece WiFi gratuita y piscina al aire libre rodeada de murales pintados.

El Catalonia Portal de l'Angel conserva gran parte de su diseño original y alberga habitaciones cómodas con aire acondicionado, TV vía satélite, set de té y café, y baño privado con secador de pelo.

El Catalonia Portal de l'Angel sirve un desayuno buffet todos los días de 07:30 a 11:00.

El famoso paseo de Las Ramblas se halla a menos de 200 metros y la catedral de Barcelona, a 100 metros. Además, el Portal del Ángel está situado a solo 5 minutos a pie de la estación de metro y tren de Catalunya."
