,Hotel Names,Rating,Stars,Location,Center Distance,Price,Description
709,Housalia Sant Pau Views- Suite with View on Hospital Sant Pau,"8,8",4,Eixample,2.7,2.042,"Housalia Sant Pau Views- Suite with View on Hospital Sant Pau se encuentra en el barrio de Eixample, en Barcelona, a 10 min a pie de Sagrada Familia, a 2,8 km de La Pedrera y a 3,1 km de Paseo de Gracia. Dispone de vistas a la ciudad y wifi gratis en todo el alojamiento.

Este apartamento con aire acondicionado consta de 1 dormitorio, una sala de estar, una cocina totalmente equipada con nevera y cafetera, y 1 baño con ducha y artículos de aseo gratuitos. Hay toallas y ropa de cama en el apartamento.

Casa Batlló está a 3,3 km del alojamiento, y Parque Güell está a 3,7 km. El aeropuerto (Aeropuerto de Barcelona - El Prat) está a 16 km."
710,Aparthotel Mariano Cubi Barcelona,"8,3",4,Sarrià,2.1,1.453,"El Aparthotel Mariano Cubi se encuentra a solo 200 metros de la avenida Diagonal y a 15 minutos a pie del paseo de Gràcia de Barcelona. Ofrece habitaciones con aire acondicionado y conexión WiFi gratuita, y algunas de ellas tienen zona de cocina.

Las habitaciones son amplias y cuentan con suelo de madera, TV vía satélite y escritorio. A la llegada, el establecimiento recibe a los huéspedes con una copa de cava gratuita.

El Aparthotel Mariano Cubi facilita servicio de información turística acerca de Barcelona. También hay un centro de negocios de acceso gratuito con conexión a internet.

La zona alberga una gran variedad de tiendas. El establecimiento está a unos 500 metros de la estación de metro Fontana y a solo 150 metros de la estación de FGC de Gràcia, desde donde se puede llegar fácilmente a la plaza de Cataluña y a Las Ramblas. La Pedrera de Gaudí queda a unos 20 minutos a pie."
711,En el Corazón de Barcelona,"8,3",4,Eixample,1.2,2.144,"En el Corazón de Barcelona es un alojamiento con una ubicación ideal en el centro de Barcelona que ofrece balcón. Casa Batlló y Plaza Cataluña están a 9 min a pie y a 1,3 km del apartamento, y hay wifi gratis.

Este apartamento con aire acondicionado consta de 2 dormitorios, una sala de estar, una cocina totalmente equipada con nevera y cafetera, y 1 baño con ducha y artículos de aseo gratuitos. Hay toallas y ropa de cama en el apartamento.

Cerca del alojamiento hay puntos de interés como Estación de metro Passeig de Gràcia, Paseo de Gracia y Teatro Tívoli. El aeropuerto (Aeropuerto de Barcelona - El Prat) está a 13 km."
712,Ola Living Paseo de Gracia,"8,7",4,Eixample,1.1,3.155,"Ola Living Paseo de Gracia ofrece alojamiento con wifi gratis, cocina, nevera, lavavajillas y horno a 1,2 km del centro de Barcelona.

Cada unidad tiene baño privado, ducha, aire acondicionado, TV y microondas. También hay fogones y tostadora, además de cafetera y hervidor.

Cerca del alojamiento hay puntos de interés como Paseo de Gracia, Casa Batlló y La Pedrera. El aeropuerto (Aeropuerto de Barcelona - El Prat) está a 13 km."
713,Espais Blaus Apartments,"9,2",4,Gracia,1.9,1.741,"Estos elegantes apartamentos, situados a solo 400 metros de la estación de metro de Joanic, ofrecen conexión WiFi gratuita, TV de pantalla plana y zona de cocina con lavadora/secadora de ropa, horno y lavavajillas. El edificio dispone de una solárium en la azotea.

Los luminosos apartamentos cuentan con aire acondicionado y una amplia zona de estar/comedor con sofá cama. Todos tienen un baño moderno con secador de pelo. Se proporcionan toallas y ropa de cama.

Hay un pequeño supermercado justo debajo de los apartamentos y el mercado de la Abaceria Central está a solo 250 metros. A 5 minutos a pie hay muchos bares, tiendas y restaurantes.

El Espais Blaus Apartments está en una zona tranquila del popular barrio de Gracia. El paseo de Gracia y La Pedrera de Gaudí se encuentran a solo 15 minutos a pie."
714,Aspasios Catedral Apartments,"8,5",4,Ciutat Vella,0.4,2.173,"El Aspasios Catedral Apartments goza de una ubicación céntrica, a 2 minutos a pie de la catedral de Barcelona y a 4 minutos de la plaza Catalunya. Ofrece WiFi gratuita y cuenta con una pequeña piscina en la azotea con solárium y vistas a la catedral.

Los apartamentos son amplios y modernos y disponen de suelo de madera, sala de estar con sofá y Smart TV con conexión a Skype y a internet También cuenta con zona de cocina bien equipada con lavadora y lavavajillas
El Catedral Bas Apartments se encuentra en la esquina de la famosa calle comercial Portal de l'Àngel, a poca distancia a pie de varios museos, tiendas y restaurantes, y a 5 minutos a pie de las Ramblas y el paseo de Gràcia.

El establecimiento está frente a un parque infantil, a 10 minutos a pie del puerto y a 15 minutos a pie de la playa. También hay un parque infantil enfrente.

Los autobuses que van al aeropuerto paran en la cercana Plaça de Catalunya, donde hay varias conexiones de metro, tren y autobús."
715,ICON Bcn,"8,7",4,Eixample,0.45,1.956,"Este hotel boutique se encuentra en el centro de Barcelona, ​​a 5 minutos a pie de la plaza de Cataluña y del paseo de Gracia. Hay préstamo de bicicletas, WiFi gratuita y iPads de uso gratuito (sujetos a disponibilidad).

Las habitaciones del ICON Bcn by Petit Palace tienen una decoración moderna, TV de pantalla plana y ducha.

Además, el establecimiento cuenta con un bar, un restaurante de cocina mediterránea, recepción 24 horas y servicio de alquiler de scooters, sujeto a disponibilidad.

El establecimiento ICON Bcn by Petit Palace está a solo 7 minutos a pie del Barrio Gótico, que alberga el Palau de la Música Catalana, y a menos de 5 minutos a pie de las estaciones de metro de Urquinaona y Paseo de Gracia. La Pedrera de Gaudí queda a 750 metros, y el parque de la Ciutadella está a 15 minutos a pie."
716,ApartEasy - Family Sant Antoni apt.,"7,5",3,Eixample,1.2,2.271,"ApartEasy - Family Sant Antoni apt., que tiene vistas a la ciudad, dispone de alojamiento con balcón y hervidor a unos 17 min a pie de Plaza Cataluña. El alojamiento está a 18 min a pie de Portal del Ángel y tiene wifi gratis en todo el alojamiento.

Este apartamento con aire acondicionado consta de 3 dormitorios, una sala de estar, una cocina totalmente equipada con nevera y cafetera, y 2 baños con ducha y secador de pelo. Hay toallas y ropa de cama en el apartamento.

Cerca del alojamiento hay puntos de interés como Estación de metro Passeig de Gràcia, Teatro Tívoli y Paseo de Gracia. El aeropuerto (Aeropuerto de Barcelona - El Prat) está a 12 km."
717,Urban Flats Vallirana,"8,5",3,Sarrià,2.6,1.450,"Urban Flats Vallirana está en Barcelona, cerca de Paseo de Gracia, La Pedrera, y Parque Güell, y ofrece wifi gratis.

El alojamiento tiene aire acondicionado, cocina totalmente equipada y con zona de comedor, TV de pantalla plana y baño privado con ducha, artículos de aseo gratuitos y secador de pelo. También hay nevera, lavavajillas y horno, además de hervidor.

Casa Batlló está a 2,6 km del alojamiento, y Estación de metro Passeig de Gràcia está a 3,1 km. El aeropuerto (Aeropuerto de Barcelona - El Prat) está a 15 km."
718,Eric Vökel Boutique Apartments - Gran Vía Suites,"9,1",4,Eixample,1.6,2.448,"El establecimiento Eric Vökel Gran Via Suites ofrece apartamentos boutique en el centro de Barcelona, a 10 minutos a pie de la plaza de España. Los apartamentos son elegantes y están equipados con WiFi gratuita.

Todos los apartamentos del Eric Vökel tienen una bonita decoración de estilo contemporáneo y están equipados con aire acondicionado, zona de cocina bien equipada y zona de estar amplia con TV de pantalla plana.

Hay numerosos bares y cafeterías a unos 100 metros del establecimiento Suites. Estos apartamentos están ubicados en la Gran Vía, cerca de varios supermercados y tiendas.

El establecimiento Vökel se encuentra a solo 20 minutos a pie de la montaña de Montjuic y del Museo Nacional de Arte de Cataluña. El famoso paseo de Las Ramblas y el Barrio Gótico de los alrededores quedan a 10 minutos en metro."
719,Key Gracia Apartments,"8,1",3,Horta,2.4,2.646,"El Gracia Apartments ofrece varios apartamentos en el moderno barrio barcelonés de Gràcia, ​​a 750 metros de la emblemática basílica de la Sagrada Familia de Gaudí. Los apartamentos son modernos y cuentan con aire acondicionado y WiFi gratis.

Todos los apartamentos presentan una decoración elegante con suelo de parquet y algunos disponen de terraza privada. También incluyen salón con sofá y TV de pantalla plana, cocina con horno, fogones, microondas y lavadora y 2 baños, uno con bañera y el otro con ducha. Además, se proporcionan toallas, ropa de cama y secador de pelo. La dirección de cada apartamento figura en su descripción.

El establecimiento puede proporcionar información turística sobre la zona de los alrededores y se encuentra a 7 minutos a pie del hospital de Sant Pau, declarado Patrimonio de la Humanidad por la UNESCO.

Los apartamentos están a 450 metros de las estaciones de metro de Joanic y Sagrada Familia, que ofrece buenas conexiones con toda la ciudad."
720,Bonavista Apartments - Passeig de Gracia,"9,2",4,Gracia,1.5,2.221,"Estos apartamentos están situados cerca de la exclusiva avenida comercial Paseo de Gracia. Presentan un estilo elegante y un diseño moderno y disponen de aire acondicionado y conexión Wi-Fi gratuita.

Los apartamentos Bonavista tienen mucha luz natural y cuentan con suelo de madera y muebles y obras de arte contemporáneas. Incluye la ropa de cama y las toallas.

Los apartamentos están bien equipados y disponen de comedor amplio y cocina equipada con horno, lavavajillas y lavadora.

El barrio de Gracia está cerca de los apartamentos y alberga muchos bares de moda y plazas agradables. La Pedrera y la Casa Batlló de Gaudí se encuentran en el Paseo de Gracia."
721,Suites4days Provenza Apartment,"9,0",4,Eixample,2.0,1.851,"Suites4days Provenza Apartment está en Barcelona, a 2 min a pie de Sagrada Familia y a 1,6 km de La Pedrera, y dispone de alojamiento con wifi gratis, aire acondicionado y terraza. Este apartamento está a 1,9 km de Casa Batlló y a 1,8 km de Paseo de Gracia.

El apartamento cuenta con balcón y vistas a la ciudad, y tiene 1 dormitorio, una sala de estar, TV, una cocina equipada con microondas y 1 baño con ducha. Hay toallas y ropa de cama en el apartamento.

Estación de metro Passeig de Gràcia está a 2,6 km del alojamiento, y Teatro Tívoli está a 2,7 km. El aeropuerto más cercano (Aeropuerto de Barcelona - El Prat) está a 15 km."
722,NEW! Amazing 2 bedroom apartment in Rambla del Poblenou,"7,7",3,Sant Martí,3.0,2.208,"NEW! Amazing 2 bedroom apartment in Rambla del Poblenou es un alojamiento con vistas a la ciudad que está en Barcelona, a 19 min a pie de Playa de la Mar Bella y a 1,6 km de Platja del Bogatell. Este alojamiento frente a la playa ofrece wifi gratis y acceso a un balcón.

Este apartamento con aire acondicionado consta de 2 dormitorios, una sala de estar, una cocina totalmente equipada con nevera y cafetera, y 1 baño con bañera y artículos de aseo gratuitos. Hay toallas y ropa de cama en el apartamento.

En recepción se habla inglés, español y francés, y el personal está dispuesto a ayudar en cualquier momento.

Platja de la Nova Mar Bella está a 1,9 km del alojamiento, y Sagrada Familia está a 2,4 km. El aeropuerto (Aeropuerto de Barcelona - El Prat) está a 16 km."
723,"SANT ANTONI HOSTAL, Sustainable Tourism","7,1",1,Eixample,0.9,1.612,"SANT ANTONI HOSTAL, Sustainable Tourism se encuentra en el centro de Barcelona, a 12 min a pie de Plaza Cataluña y a 1,3 km de Portal del Ángel. Este hostal o pensión de 1 estrella ofrece salón de uso común y habitaciones con aire acondicionado, wifi gratis y baño privado. Hay parking privado en el propio alojamiento.

Todas las unidades incluyen nevera, microondas, cafetera, ducha, secador de pelo y armario. Las habitaciones disponen de ropa de cama.

En el hostal o pensión se sirve un desayuno continental.

Cerca del alojamiento hay puntos de interés como Estación de metro Passeig de Gràcia, Teatro Tívoli y Paseo de Gracia. El aeropuerto (Aeropuerto de Barcelona - El Prat) está a 12 km, y el alojamiento ofrece servicio de traslado de pago para ir o volver del aeropuerto."
724,Murmuri Residence Mercader,"8,7",4,Eixample,1.0,2.367,"Murmuri Residence Mercader is situated in the Eixample district in Barcelona. La Pedrera is 300 metres from the property. Free WiFi is featured throughout the property.

All units include a satellite flat-screen TV and iPod docking station. Some units have a terrace and/or balcony with city views. There is also a kitchen, fitted with a dishwasher. An oven is also provided, as well as a coffee machine and a kettle. There is a private bathroom with free toiletries and a hairdryer in each unit. Towels are offered.

If your apartment is not available upon arrival or you need to store your luggage on the day of departure, free individual lockers are available for you next to the elevators on the main floor. The hours of use are from 7 a.m. to 8 p.m.

Casa Batllo is 400 metres from Murmuri Residence Mercader, while Plaça Catalunya is 1 km away. The nearest airport is Barcelona El Prat Airport, 13 km from the property."
725,Sagrada Familia - Sant Pau apartment,"8,0",4,Eixample,2.1,2.339,"Sagrada Familia - Sant Pau apartment, que tiene vistas a la ciudad, dispone de alojamiento con balcón y hervidor a unos 3 min a pie de Sagrada Familia. Casa Batlló y La Pedrera están a 2,3 km y a 1,7 km del apartamento, y hay wifi gratis.

Este apartamento con aire acondicionado consta de 2 dormitorios, una sala de estar, una cocina totalmente equipada con nevera y cafetera, y 1 baño con ducha y artículos de aseo gratuitos. Hay toallas y ropa de cama en el apartamento.

Se puede descubrir la zona practicando ciclismo en los alrededores.

Paseo de Gracia está a 1,9 km del alojamiento, y Estación de metro Passeig de Gràcia está a 2,8 km. El aeropuerto (Aeropuerto de Barcelona - El Prat) está a 15 km, y el alojamiento ofrece servicio de traslado de pago para ir o volver del aeropuerto."
726,Balmes Private Rooms,"4,6",,Eixample,1.0,530,"Balmes Private Rooms está muy bien situado en el barrio de Eixample, Barcelona, a 14 min a pie de Plaza Cataluña, a 1 km de Estación de metro Passeig de Gràcia y a 14 min a pie de Teatro Tívoli. El alojamiento se encuentra a 6 min a pie de La Pedrera, a 1,5 km de Portal del Ángel y a 5 min a pie de Paseo de Gracia. El alojamiento está a 7 min a pie de Casa Batlló y a 1,1 km del centro de la ciudad.

Las habitaciones de este alojamiento están equipadas con hervidor. Las habitaciones del alojamiento tienen baño compartido con ducha y artículos de aseo gratuitos. También disponen de wifi gratis, y algunas habitaciones también tienen vistas a la ciudad. En el albergue, todas las habitaciones están equipadas con ropa de cama y toallas.

Cerca del alojamiento hay puntos de interés como Mercado de la Boquería, Palacio de la Música Catalana y Catedral de Barcelona. El aeropuerto más cercano (Aeropuerto de Barcelona - El Prat) está a 13 km del alojamiento."
727,Ola Living Portaferrissa,"8,4",4,Ciutat Vella,0.5,2.301,"El Ola Living Portaferrissa está situado en el centro y ofrece apartamentos y estudios con aire acondicionado, WiFi gratuita y caja fuerte gratuita. Los alojamientos están a 100 metros de las Ramblas y a 5 minutos a pie de la plaza de Cataluña.

Todos los alojamientos tienen muebles modernos y funcionales, TV de pantalla plana por cable y zona de cocina totalmente equipada con cafetera, microondas y horno. También se incluye lavadora, secadora de ropa y utensilios de planchado.

El Ola Living Portaferrissa está rodeado de gran variedad de bares, restaurantes y granjas tradicionales españolas para disfrutar de un aperitivo o una comida ligera. El mercado de La Boquería, a 200 metros, ofrece productos frescos.

El Ola Living Portaferrissa está a 5 minutos a pie de la catedral. El alojamiento está a 400 metros de la animada plaza Real y a 7 minutos a pie del Museo de Arte Contemporáneo de Barcelona. La estación de metro más cercana es Liceu, a solo 300 metros."
728,Elegantniy Poble Sec,"8,5",4,Sants,1.8,2.257,"Este apartamento está situado en Barcelona y ofrece WiFi gratuita. Montjuïc está a 700 metros.

Este apartamento cuenta con aire acondicionado, 2 dormitorios, TV de pantalla plana y salón comedor. La cocina está equipada con lavavajillas, horno, microondas, cafetera y hervidor de agua. Tambiénncluye toallas y ropa de cama.

El Elegantniy Poble Sec se encuentra a 1,4 km del Palau Sant Jordi y a 1,6 km de la plaza Real. El aeropuerto más cercano es el de Barcelona El Prat, ubicado a 11 km del Elegantniy Poble Sec."
729,Brummell Apartments Eixample Izquierda/Valeris,"8,8",3,Eixample,0.9,2.438,"Brummell Apartments Eixample Izquierda/Valeris se encuentra a 11 min a pie de Estación de metro Passeig de Gràcia y ofrece alojamiento con balcón y wifi gratis.

El alojamiento tiene aire acondicionado, cocina totalmente equipada y con zona de comedor, TV de pantalla plana y baño privado con ducha, artículos de aseo gratuitos y secador de pelo. También se ofrece nevera, microondas y fogones, además de cafetera y hervidor.

El apartamento ofrece servicio de alquiler de bicicletas.

Cerca del alojamiento hay puntos de interés como Plaza Cataluña, Teatro Tívoli y Portal del Ángel. El aeropuerto (Aeropuerto de Barcelona - El Prat) está a 12 km, y el alojamiento ofrece servicio de traslado de pago para ir o volver del aeropuerto."
730,Renaissance Barcelona Hotel,"8,2",5,Eixample,0.6,2.179,"El Renaissance Barcelona Hotel está situado en el centro de la ciudad, a pocos pasos del Passeig de Gràcia, el principal bulevar comercial, numerosos bares y restaurantes, lugares de interés y lugares de interés cultural.

Las elegantes habitaciones del Renaissance Barcelona Hotel han sido diseñadas imaginativamente para ofrecer un destino independiente, perfecto para relajarse y recargar después de un día explorando Barcelona.

Las habitaciones presentan una decoración exclusiva y elegante inspirada en Gaudí y cuentan con suelo de parqué, ropa de cama de lujo y baño de mármol con artículos de aseo exclusivos.

El elegante Rumbo Bar & Eatery del hotel sirve platos mediterráneos elaborados con productos locales. El bar sirve cócteles de autor, vinos y cerveza artesanal local. La azotea, Goja Rooftop es el lugar ideal para aprovechar el momento, socializar, disfrutar de deliciosa comida mediterránea, cócteles inventivos y una gran conversación.

El personal de la recepción puede ayudarle a reservar entradas para espectáculos y visitas guiadas, así como proporcionar información sobre qué ver y hacer en Barcelona.

La Casa Batlló y La Pedrera de Gaudí se encuentran a 10 minutos a pie del Renaissance Barcelona Hotel."
731,Flateli Lepant,"7,1",3,Eixample,1.7,2.446,"Flateli Lepant está en el barrio de Eixample, en Barcelona, a 19 min a pie de Platja de la Nova Icària, a 1,9 km de Platja del Somorrostro y a 2 km de Platja del Bogatell. Tiene vistas a la ciudad y wifi gratis en todo el alojamiento.

Este apartamento con aire acondicionado consta de 2 dormitorios, una sala de estar, una cocina totalmente equipada con nevera y cafetera, y 1 baño con ducha y secador de pelo. Hay toallas y ropa de cama en el apartamento.

El apartamento ofrece servicio de alquiler de bicicletas.

Cerca del alojamiento hay puntos de interés como Sagrada Familia, Port Olimpic y Santa María del Mar. El aeropuerto más cercano (Aeropuerto de Barcelona - El Prat) está a 15 km del alojamiento, que ofrece servicio de traslado de pago para ir o volver del aeropuerto."
732,Hostal Delfos,"8,0",2,Eixample,0.6,995,"El Hostal Delfos está situado en el centro de Barcelona, a sólo 3 minutos a pie de las famosas Ramblas y la Plaza Catalunya. Este hostal dispone de conexión inalámbrica a internet gratuita en todas sus instalaciones.

El Delfos ofrece habitaciones con baño privado o compartido. Las habitaciones están equipadas con ventilador y calefacción.

El barrio Gótico y la catedral están a 5 minutos a pie del hostal y el Museo Picasso está a 15 minutos. Los huéspedes podrán solicitar información sobre la zona en el mostrador turístico.

El aeropuerto de Barcelona está a 30 minutos en autobús desde la Plaza Catalunya."
733,Rent Top Apartments Beach-Diagonal Mar,"7,7",3,Sant Martí,4.3,3.313,"El Rent Top Apartments ofrece diferentes apartamentos situados en el moderno barrio de Diagonal Mar de Barcelona, a 10 minutos a pie de la playa. El establecimiento dispone de apartamentos elegantes con terrazas privadas con vistas a la ciudad, al jardín o a la playa.

El Rent Top Apartments se encuentra a menos de 5 minutos a pie del centro comercial Diagonal Mar y del Edificio Fórum. Hay una parada de autobús turístico y una parada de taxis frente al establecimiento, al que también se puede llegar en metro.

Los apartamentos, amplios y luminosos, presentan una decoración moderna en tonos claros y cuentan con aire acondicionado, WiFi gratuita y servicio de seguridad las 24 horas. Todos ellos disponen de salón con TV de pantalla plana y reproductor de DVD, cocina bien equipada y baño privado. Algunos apartamentos proporcionan acceso a una piscina de temporada compartida.

Los apartamentos del Rent Top ofrecen vistas al mar y a la ciudad e incluyen ropa de cama, toallas, calefacción y lavadora."
734,ApartEasy - Atic Sants,"7,6",3,Sants,3.5,2.007,"ApartEasy - Atic Sants se encuentra en el barrio de Sants-Montjuïc, en Barcelona, cerca de Estación de tren de Sants. Tiene terraza, wifi gratis y lavadora. El apartamento ofrece parking privado y está a 1,9 km de Fuente Mágica de Montjuïc.

Este apartamento con aire acondicionado consta de 2 dormitorios, una sala de estar, una cocina totalmente equipada con nevera y cafetera, y 1 baño con ducha y secador de pelo. Hay toallas y ropa de cama en el apartamento.

Camp Nou está a 3,1 km del alojamiento, y Palau Sant Jordi está a 3,3 km. El aeropuerto más cercano (Aeropuerto de Barcelona - El Prat) está a 9 km."
735,Alcam Paseo San Juan,"7,6",3,Gracia,1.7,1.747,"Alcam Paseo San Juan se encuentra en Barcelona, a 12 min a pie de La Pedrera y a 1,1 km de Paseo de Gracia, y ofrece vistas a la ciudad y wifi gratis.

Algunas unidades incluyen aire acondicionado, TV de pantalla plana, lavadora, cafetera y cocina.

Cerca del alojamiento hay puntos de interés como Sagrada Familia, Casa Batlló y Estación de metro Passeig de Gràcia. El aeropuerto (Aeropuerto de Barcelona - El Prat) está a 14 km, y el alojamiento ofrece servicio de traslado de pago para ir o volver del aeropuerto."
736,B-Garden BCN,"9,1",2,Eixample,0.8,1.860,"BGarden BCN is a small and cozy guest-house which offers a personalized service.
Housed in a Art Nouveau building and placed in one of the best locations in Barcelona for travelers, our goal is to make guests feel at home.

It is 10 min by foot to Passeig de Gràcia Boulevard, Plaça Catalunya, Las Ramblas and Arc de Triumf. You can find all kind of shops, restaurants and bars nearby.
As you were in a typical Spanish 1900’s house with authentical vitreaux and high ceilings, B-Garden BCN offers rooms with private balcony and most of them have private and renovated bathrooms.
All the rooms at B-Garden BCN feature tiled floors and stylish dècor, with a mix of antique and modern mobiliary. We offer flat-screen Smart T.V, free Wi-Fi connection and a varied buffet breakfast.
Barcelona’s charming Born district is just 7 minutes’ walk from B-Garden BCN. Here you can find the Palau de la Música Catalana and a Modernist Auditorium.
Tetuán metro station is only 100 metres away and it connects you with the rest of the city, as well as all the buses options in Gran Via de les corts catalanes avenue, just round the corner."
737,Suite Miro Eixample Barcelona,"8,8",3,Eixample,1.9,1.919,"Suite Miro Eixample Barcelona se encuentra en Barcelona, a 11 min a pie de Estación de tren de Sants y a 1,4 km de Fuente Mágica de Montjuïc, y ofrece alojamiento con equipamiento como wifi gratis y TV de pantalla plana. Ofrece balcón y terraza.

El apartamento tiene 1 dormitorio, una cocina con nevera y lavavajillas, y 1 baño con ducha, artículos de aseo gratuitos y lavadora. Hay toallas y ropa de cama en el apartamento.

Casa Batlló está a 2 km del alojamiento, y Paseo de Gracia está a 2,2 km. El aeropuerto más cercano (Aeropuerto de Barcelona - El Prat) está a 11 km."
738,Apartaments Ciutat Vella,"7,7",3,Ciutat Vella,0.6,2.566,"Set just off Barcelona’s famous Las Ramblas, the Apartments Ciutat Vella offer modern accommodation on a pedestrian street in the Gothic Quarter. La Boquería Market is just 30 metres away.

The air-conditioned apartments combine authentic features, such as traditional stone walls and wooden beams, with modern design and free Wi-Fi. The lounge area comes with a 32-inch flat-screen TV with international channels, and the contemporary kitchen includes a microwave and Nespresso coffee machine.

The apartments are surrounded by popular shops, boutiques and cafés.

Liceu Metro Station is just 2 minutes’ walk away, and you can reach Barcelona Port and Plaza de Cataluña in 10 minutes’ walk."
