,Hotel Names,Rating,Stars,Location,Center Distance,Price,Description
0,chic&basic Habana Hoose,"8,5",3,Ciutat Vella,0.9,1.447,"Chic&basic Habana Hoose es un alojamiento con una ubicación excelente en Barcelona que ofrece restaurante, wifi gratis, bar y habitaciones con aire acondicionado. Este hotel de 3 estrellas ofrece servicio de conserjería y mostrador de información turística. Este alojamiento libre de humo se encuentra a 18 min a pie de Platja del Somorrostro.

En el hotel, todas las habitaciones tienen armario, TV de pantalla plana, baño privado, ropa de cama y toallas. Cada habitación dispone de caja fuerte, y algunas también ofrecen balcón.

En chic&basic Habana Hoose se puede disfrutar de un desayuno buffet.

La recepción ofrece ayuda de forma ininterrumpida, y el personal habla catalán, inglés y español.

Cerca del alojamiento hay puntos de interés como Platja de Sant Miquel, Platja de la Barceloneta y Santa María del Mar. El aeropuerto (Aeropuerto de Barcelona - El Prat) está a 12 km, y el alojamiento ofrece servicio de traslado de pago para ir o volver del aeropuerto."
1,Melia Barcelona Sarriá,"8,2",5,Les Corts,2.4,1.664,"El Meliá Barcelona Sarriá cuenta con spa, gimnasio 24 horas y restaurante. Se halla a 2 km de La Pedrera y la Casa Batlló, unas de las obras más importantes de Gaudí. Hay WiFi gratuita en todas las zonas.

Las habitaciones del Meliá Barcelona Sarriá presentan una decoración elegante de estilo contemporáneo y cuentan con TV de 42 pulgadas y baño con acabados en mármol y bañera o ducha.

Todas las habitaciones de categoría Level Lounge ofrecen servicios superiores, como zonas privadas exclusivas, zona de recepción privada con atención personalizada y 1 acceso gratuito por estancia al spa Serena del hotel.

Todas las mañanas se sirve un desayuno buffet internacional, que incluye productos sin gluten y opciones para dietas especiales. El restaurante Prezzemolo, un pedazo de Italia en el centro de Barcelona. Con una cocina abierta y un horno evocando las trattorias más auténticas.

La exclusiva avenida comercial Diagonal queda a solo 1 calle, mientras que el estadio Camp Nou del F. C. Barcelona está a unos 10 minutos en coche. Este alojamiento se encuentra a solo 200 metros de la plaza Francesc Macià y a unos 20 minutos a pie del elegante Passeig de Gràcia."
2,Silken Sant Gervasi,"8,6",3,Sarrià,3.2,830,"Este hotel elegante está situado en Barcelona, en el tranquilo distrito de Sant Gervasi, y ofrece habitaciones modernas con conexión a internet gratuita. El Silken queda a solo 8 minutos en tren de la plaza Catalunya.

El restaurante del Silken San Gervasi está especializado en cocina tradicional con influencias modernas. En la cafetería se sirve un desayuno buffet y también se ofrecen bebidas y aperitivos durante todo el día.

Las habitaciones son funcionales e incluyen caja fuerte de uso gratuito, calefacción central, aire acondicionado y baño de mármol con secador de pelo.

El Silken St. Gervasi se encuentra a 15 minutos a pie del parque Güell, que acoge impresionantes estructuras, mosaicos y arquitectura de Antoni Gaudí. La estación de El Putxet queda a 50 metros del hotel y conecta con el centro de la ciudad."
3,"Labtwentytwo Barcelona, a Tribute Portfolio Hotel","8,4",4,Sant Martí,3.4,1.162,"Labtwentytwo Barcelona, a Tribute Portfolio Hotel se encuentra en Barcelona, a 1,9 km de Platja de la Nova Mar Bella, y ofrece alojamiento con piscina al aire libre, parking privado, centro de fitness y terraza. Este alojamiento ofrece restaurante, recepción 24 horas y centro de negocios, además de wifi gratis en todo el alojamiento. Hay bar.

En el hotel, todas las habitaciones disponen de aire acondicionado, zona de estar, TV de pantalla plana con canales por cable, caja fuerte y baño privado con ducha, artículos de aseo gratuitos y secador de pelo. Labtwentytwo Barcelona, a Tribute Portfolio Hotel dispone de algunas unidades con vistas a la ciudad, y todas tienen cafetera. En el alojamiento, todas las habitaciones tienen ropa de cama y toallas.

El desayuno ofrece opciones buffet, a la carta o continentales.

Platja de Llevant está a 2,1 km del alojamiento, y Playa de la Mar Bella está a 2,1 km. El aeropuerto (Aeropuerto de Barcelona - El Prat) está a 17 km."
4,Casa Bella Gracia by Aspasios,"8,5",,Gracia,1.5,1.050,"Casa Bella Gracia by Aspasios is less than 5 minutes’ walk from Passeig de Gràcia and Diagonal Avenue. This boutique hotel features 11 attractive rooms.

Our accommodation has been completely renewed in December 2023. The modern furnishings of the rooms, designed by interior design experts, and every detail have been carefully selected to offer you a unique experience during your stay in Barcelona.

Each room at Casa Bella Gracia by Aspasios has contemporary décor finished in sand colours. All rooms have air conditioning, a flat-screen TV and free Wi-Fi, as well as a kettle, a coffee machine and a safety box, and there is a shared terrace available for all guests.


A range of cafés, bars and restaurants can be found in the surrounding Gràcia district. The charming squares at Plaza del Sol and Plaza de la Vila de Gràcia can be reached in 10 minutes by foot.

Diagonal Metro Station is just 400 metres away and is 3 stops from Plaza de Catalunya and Las Ramblas. Gaudí’s La Pedrera is less than 10 minutes’ walk from the Bella Gracia."
5,Occidental Barcelona 1929,"8,8",3,Sants,2.3,1.148,"Occidental Barcelona 1929 dispone de piscina de temporada al aire libre, centro de fitness, terraza y bar en Barcelona. Todas las opciones de alojamiento de este hotel de 3 estrellas tienen vistas a la ciudad y wifi gratis. Este alojamiento libre de humo se encuentra a 7 min a pie de Fuente Mágica de Montjuïc.

El hotel ofrece habitaciones con aire acondicionado, armario, hervidor, minibar, caja fuerte, TV de pantalla plana y baño privado con ducha. En Occidental Barcelona 1929, todas las habitaciones incluyen ropa de cama y toallas.

En el alojamiento se puede disfrutar de un desayuno buffet.

En la recepción 24 horas se habla catalán, inglés, español y francés, y el personal está dispuesto a ayudar en cualquier momento.

Estación de tren de Sants está a 12 min a pie del alojamiento, y Palau Sant Jordi está a 1,7 km. El aeropuerto (Aeropuerto de Barcelona - El Prat) está a 10 km."
6,Motel One Barcelona-Ciutadella,"8,8",3,Sant Martí,1.3,1.180,"El Motel One Barcelona-Ciutadella se encuentra en el distrito del Born de Barcelona, ​​junto al parque de la Ciutadella, y ofrece habitaciones modernas con aire acondicionado, baño privado y TV interactiva.

El Motel One Barcelona-Ciutadella cuenta con un bar salón abierto las 24 horas y ofrece un desayuno continental todas las mañanas. El hotel también tiene una terraza en la azotea con vistas al parque de la Ciutadella, al mar y al perfil urbano de Barcelona.

La Plaça Catalunya y las Ramblas se encuentran a 20 minutos a pie, al igual que el Puerto Olímpico de Barcelona. La Sagrada Familia está a 30 minutos a pie.

La estación de metro y tren de Arc de Triomf está a solo 400 metros. En transporte público, el Motel One se halla a solo 20 minutos del centro de convenciones internacional-CCIB FORUM y a 30 minutos del centro de exposiciones Fira Barcelona."
7,Hostal Gràcia,"8,3",3,Gracia,1.7,1.011,"Hostal Gràcia está muy bien situado en el barrio de Gracia, Barcelona, a 16 min a pie de Estación de metro Passeig de Gràcia, a 1,6 km de Teatro Tívoli y a 2,7 km de Palacio de la Música Catalana. El hostal o pensión, que cuenta con jardín, está cerca de varios lugares de interés destacados, a unos pocos pasos de Paseo de Gracia, a 7 min a pie de La Pedrera y a 1,1 km de Casa Batlló. Hay wifi gratis y se ofrece parking privado por un suplemento.

El hostal o pensión ofrece habitaciones con aire acondicionado, escritorio, cafetera, nevera, minibar, caja fuerte, TV de pantalla plana, terraza y baño privado con ducha. Hostal Gràcia ofrece algunas unidades con vistas a la ciudad, y todas cuentan con balcón. En el alojamiento, todas las habitaciones tienen ropa de cama y toallas.

Parque Güell está a 2,8 km del alojamiento, y Plaza Cataluña está a 1,8 km. El aeropuerto (Aeropuerto de Barcelona - El Prat) está a 15 km."
8,NH Barcelona Les Corts,"8,4",3,Les Corts,2.8,974,"Este hotel, situado a 5 minutos a pie de la estación de metro de Les Corts, ofrece un alojamiento moderno en Barcelona. Tiene buen acceso a los principales lugares de interés de la ciudad, como el Camp Nou.

Las habitaciones del NH Barcelona Les Corts cuentan con aire acondicionado, una decoración contemporánea, WiFi gratuita, TV vía satélite y balcón o terraza privados. El baño privado tiene secador de pelo y artículos de aseo.

El hotel tiene mostrador de información turística y recepción 24 horas. El personal es amable y puede proporcionar información sobre Barcelona y ayudar a concertar el alquiler de bicicletas y vehículos.

El NH Les Corts está a menos de 10 minutos a pie de la estación de trenes de Sants, que enlaza con el aeropuerto de Barcelona. El centro comercial L'Illa Diagonal está a solo 300 metros. El aeropuerto de Barcelona se encuentra a 15 km."
9,NH Barcelona Diagonal Center,"8,2",3,Sant Martí,2.2,1.061,"Este hotel de diseño está a 15 minutos de la playa, en el barrio barcelonés de Poblenou, en la zona empresarial de 22@. Desde la estación de metro de Bogatell, a 350 metros, se llega al centro de Barcelona en 25 minutos.

Las modernas habitaciones del NH Barcelona Diagonal Center disponen de TV de pantalla plana con canales vía satélite, escritorio, minibar y caja fuerte. El baño privado incluye artículos de aseo gratuitos y secador de pelo.

El hotel sirve un desayuno buffet.

Hay cafeterías y restaurantes en la rambla de Poblenou, a 10 minutos a pie. El centro comercial Glòries también está a 10 minutos a pie.

Este hotel NH cuenta con recepción 24 horas y centro de negocios. Hay habitaciones e instalaciones adaptadas para personas de movilidad reducida, así como WiFi gratuita en todo el establecimiento.

El aeropuerto de Barcelona está a unos 18 km y el centro de convenciones CCIB, a 3 km. Se ofrece servicio de alquiler de coches y aparcamiento privado por un suplemento."
10,BCN Urbaness Hotels Bonavista,"7,8",2,Gracia,1.5,1.068,"El BCN Urbaness Hotels Bonavista se encuentra en Barcelona, a 400 metros de La Pedrera y a menos de 1 km de la Casa Batlló. Este establecimiento ofrece recepción 24 horas, mostrador de información turística y wifi gratuita en todas las instalaciones. El establecimiento ofrece habitaciones familiares.

Todas las habitaciones tienen baño privado. Algunas también incluyen balcón (según disponibilidad) y otras ofrecen vistas a la ciudad.

El hostal se halla cerca de lugares de interés populares, como el Passeig de Gràcia, la Sagrada Familia y el Teatro Tívoli. El aeropuerto más cercano es el de Barcelona El Prat, ubicado a 13 km del BCN Urbaness Hotels Bonavista."
11,Moxy Barcelona,"8,1",4,Sants,2.4,1.021,"Moxy Barcelona dispone de piscina de temporada al aire libre, centro de fitness, restaurante y bar en Barcelona. Este hotel de 4 estrellas ofrece servicio de habitaciones, recepción 24 horas y wifi gratis. El alojamiento ofrece centro de negocios, servicio de conserjería y cambio de moneda.

El hotel ofrece habitaciones con aire acondicionado, escritorio, caja fuerte, TV de pantalla plana, balcón y baño privado con ducha. En Moxy Barcelona, cada habitación incluye ropa de cama y toallas.

En el alojamiento se puede disfrutar de un desayuno buffet, continental o sin gluten.

Estación de tren de Sants está a 5 min a pie del alojamiento, y Fuente Mágica de Montjuïc está a 1,3 km. El aeropuerto (Aeropuerto de Barcelona - El Prat) está a 11 km."
12,Abba Garden,"8,4",4,Barcelona,5.7,879,"Este hotel moderno se encuentra en la zona norte de Barcelona, a poca distancia de la avenida Diagonal y del Camp Nou, el famoso estadio del FC Barcelona. Los huéspedes tienen acceso gratuito a la piscina al aire libre de temporada y al gimnasio. Hay wifi gratuita en todas las instalaciones.

Las habitaciones con vistas al exterior cuentan con TV de pantalla plana, minibar y caja fuerte. El baño incluye artículos de aseo gratuitos, bañera y secador de pelo.

Además, el Abba Garden Hotel cuenta con jardines. También hay pista de pádel.

Por la noche, los huéspedes pueden comer en el bar cafetería con terraza.

El alojamiento está situado a 10 minutos a pie de la estación de metro Zona Universitària, que ofrece conexiones con el centro de Barcelona. Asimismo, el establecimiento se halla a 13 minutos a pie de la línea 9 del metro, que ofrece conexiones con el aeropuerto en 15 minutos y con el recinto ferial Fira Barcelona en 30 minutos."
13,HOSTAL BEDMATES,"8,3",2,Sants,1.5,919,"HOSTAL BEDMATES es un alojamiento de 2 estrellas situado en Barcelona, a 2,9 km de Platja de Sant Miquel y a 2,9 km de Platja del Somorrostro. Hay wifi gratis y se ofrece parking privado por un suplemento. Algunas habitaciones del alojamiento tienen un balcón con vistas a la ciudad.

En el hotel, todas las habitaciones tienen escritorio. Todas las habitaciones del alojamiento tienen baño privado con ducha y artículos de aseo gratuitos, además de TV de pantalla plana y aire acondicionado. Algunas habitaciones incluyen terraza. En HOSTAL BEDMATES, las habitaciones tienen ropa de cama y toallas.

Hay opciones buffet o continentales de desayuno disponibles en el alojamiento.

Cerca del alojamiento hay puntos de interés como Fuente Mágica de Montjuïc, Plaza Cataluña y Santa María del Mar. El aeropuerto (Aeropuerto de Barcelona - El Prat) está a 11 km."
14,Hotel Glòries,"7,9",3,Eixample,1.9,901,"Este moderno hotel se encuentra a 200 metros de la plaza de toros Monumental de Barcelona y a 12 minutos de la Sagrada Familia. Todas las habitaciones disponen de aire acondicionado, calefacción, TV vía satélite y wifi gratuita.

La estación de metro Monumental está a solo 3 minutos a pie del Hotel Glòries, que comunica directamente con plaza Cataluña en unos 5 minutos.

El hotel goza una buena ubicación para acceder a la zona de alta tecnología 22@, además de la Torre Agbar. El Teatro Nacional de Cataluña y la sala de conciertos Auditori se encuentran a solo 400 metros.

La recepción 24 horas del Hotel Glòries ofrece servicio de alquiler de coches y bicicletas. También se pueden reservar tickets."
15,Residencia Universitaria Campus del Mar,"7,9",,Ciutat Vella,1.8,937,"La Residencia Campus del Mar está muy bien ubicada en el barrio de La Barceloneta en Barcelona, a 200 metros de la playa. Alberga un centro de fitness y ofrece conexión gratuita a internet tanto en las habitaciones como en las zonas comunes.

Las habitaciones de la Residencia Campus del Mar disponen de zona de cocina con microondas y set de té/café. La mayoría tiene TV.

La Residencia también cuenta con zona de biblioteca y sala de juegos con mesa de billar y mesa de ping pong. Hay aparcamiento privado, lavandería y recepción 24 horas. Se ofrece un servicio de alquiler de bicicletas bajo petición.

Hay varias máquinas expendedoras.

La Residencia Campus del Mar se encuentra a unos 2 minutos a pie del parque de la Ciudadela y del paseo marítimo. La estación de metro Barceloneta queda a 250 metros.

Este alojamiento permanece abierto todo el año para la comunidad universitaria (estudiantes, profesores, investigadores y personal administrativo)."
16,HG City Suites Barcelona,"8,5",4,Sarrià,2.3,1.019,"El HG City Suites Barcelona está situado en el límite del popular barrio de Gracia de Barcelona, ​​a 300 metros de la estación de metro de Fontana. Las habitaciones de este establecimiento son amplias y modernas y disponen de control de temperatura, minibar y TV de pantalla plana vía satélite.

Todos los alojamientos del HG City Suites Barcelona incluyen caja fuerte y baño privado con secador de pelo y artículos de aseo. Además, se proporciona conexión WiFi gratuita en todas las habitaciones y zonas comunes.

La estación de tren de Gracia FGC está a solo 200 metros del HG City Suites Barcelona y el autobús 24 para cerca. Ambos medios de transporte ofrecen acceso a la plaza de Cataluña en menos de 20 minutos. El Paseo de Gracia se encuentra a 15 minutos a pie del HG City Suites Barcelona.

Hay aparcamiento público disponible cerca del hotel, con descuentos especiales para los huéspedes."
17,Micampus Barcelona Student Residence,"7,9",,Barcelona,5.3,759,"Micampus Barcelona Student Residence se encuentra en Barcelona, a 15 min a pie de Platja del Fòrum, y ofrece alojamiento con centro de fitness, parking privado, jardín y salón de uso común. La residencia de estudiantes, que cuenta con bar, está cerca de varios lugares de interés destacados, a unos 17 min a pie de Platja de Llevant y a 1,8 km de Platja del Litoral. Hay terraza solárium y wifi gratis en todo el alojamiento.

En la recepción 24 horas se habla inglés y español, y el personal siempre está dispuesto a echar una mano.

Port Olimpic está a 4,6 km del alojamiento, y Sagrada Familia está a 4,9 km. El aeropuerto (Aeropuerto de Barcelona - El Prat) está a 17 km."
18,Apartaments Independencia,"8,2",3,Sant Martí,2.6,883,"El Suites Independencia está situado a solo 10 minutos a pie de la Sagrada Familia de Gaudí y a 150 metros de la estación de metro Encants y ofrece apartamentos elegantes con TV por cable.

Los apartamentos del Independencia son luminosos, presentan una decoración moderna y sencilla y cuentan con aire acondicionado, zona de estar amplia y zona de cocina bien equipada con horno. Algunos de ellos tienen también un balcón.

El establecimiento se encuentra en una zona con tiendas, cafeterías y restaurantes y a 10 minutos a pie del mercado de la Sagrada Familia.

El casco antiguo de Barcelona y las Ramblas están a solo 4 paradas de metro de Encants y las playas de Poblenou están a menos de 2 km del Suites Independencia."
19,Aparthotel Silver,"8,7",3,Gracia,2.3,886,"Situado a 100 metros de la estación de metro de Fontana, en el conocido barrio de Gràcia de Barcelona, ​​el Aparthotel Silver cuenta con recepción 24 horas, bar y terraza con jardín. Las habitaciones incluyen conexión Wi-Fi gratuita y cocina americana.

Todas las habitaciones del Aparthotel Silver presentan una decoración sencilla y elegante, y disponen de aire acondicionado, TV vía satélite, caja fuerte con capacidad para un ordenador portátil y baño privado con todas las comodidades. La cocina americana incluye horno eléctrico, hervidor de agua y nevera.

Los huéspedes pueden disfrutar de una copa en el bar del Silver y hacer uso del servicio de habitaciones. El personal de recepción les ayudará a organizar el alquiler de coches o bicicletas y les proporcionará información sobre la ciudad.

El Aparthotel Silver se encuentra a 200 metros de la Casa Vicenç, un edificio de Gaudí, a 10 minutos en metro del centro de Barcelona y a 1 parada del Parc Güell."
20,Travelodge Barcelona Poblenou,"7,3",1,Sant Martí,2.9,948,"Este moderno hotel cuenta con 250 amplias y completamente equipadas habitaciones, un Snack-Bar abierto las 24 horas donde los clientes pueden disfrutar de un desayuno buffet, así como comidas ligeras para el almuerzo y la cena. También dispone de máquinas expendedoras y parking privado de pago. Todas sus instalaciones están perfectamente adaptadas y accesibles para personas con movilidad reducida.
Es un hotel con WiFi de alta velocidad gratuito e ilimitado en las zonas comunes. También disponen de WiFi por un suplemento.
Travelodge Barcelona Poblenou es un hotel pet-friendly que estará encantado de ofrecerte a ti y a tu mascota la mejor experiencia.
Se encuentra en el tradicional barrio de Poblenou, dentro de calles llenas de restaurantes, bares y tiendas. Uno de los barrios con más encanto de la ciudad, ya 600 metros de la playa del Bogatell. Se puede llegar al centro de la ciudad de Barcelona en 10 minutos en metro y el Port Olímpic de Barcelona, con su vibrante vida nocturna, está a solo 20 minutos a pie.
Este es considerado el barrio más innovador de la ciudad. Está en pleno Distrito 22@ y concentra multitud de empresas tecnológicas y de I+D. Por tanto, gracias a su ubicación e instalaciones, también es un alojamiento perfecto para viajes de negocios.
Travelodge Barcelona Poblenou te ofrece todo lo que necesitas para tener la mejor experiencia en la ciudad de Barcelona."
21,Apartaments Sant Jordi Girona 97,"8,2",3,Eixample,1.0,1.244,"Estos apartamentos son elegantes y están situados en el barrio barcelonés del Eixample, a sólo 200 metros de la estación de metro de Girona. Presentan una decoración moderna y disponen de TV y lavadora.

La Pedrera de Gaudí está a sólo 10 minutos a pie y la avenida Passeig de Gràcia se encuentra a 600 metros. A 5 minutos a pie de los apartamentos Sant Jordi Girona 97 encontrará restaurantes y bares.

El Apartaments Sant Jordi Girona 97 ofrece apartamentos con una sala de estar amplia con sofá y una zona de comedor. La cocina dispone de nevera y fogón. Hay conexión Wi-Fi disponible por un suplemento."
22,Hotel Viladomat,"7,6",3,Eixample,1.6,969,"El Hotel Viladomat goza de una ubicación idónea en Barcelona, a menos de 10 minutos a pie de la estación de metro Hospital Clinic. Ofrece WiFi gratuita y bar.

Todas las habitaciones disponen de aire acondicionado, TV vía satélite, caja fuerte, escritorio y minibar. El baño privado incluye bañera, ducha, secador de pelo y artículos de aseo gratuitos.

El Hotel Viladomat cuenta con recepción 24 horas y servicio de venta de entradas. Además, se proporciona servicio de enlace con el aeropuerto por un suplemento y consigna de equipaje.

Está a 20 minutos a pie de la Plaza Catalunya y de las famosas Ramblas de Barcelona. Si lo desea, el personal puede proporcionarle información sobre la ciudad y los principales lugares de interés. El Hotel Viladomat se encuentra a 1 km de la estación de Sants, con servicio directo al aeropuerto de Barcelona."
23,Leonardo Hotel Barcelona Gran Via,"8,6",3,Eixample,1.4,1.052,"Este hotel amplio y moderno se encuentra en el barrio del Eixample, construido en 2004, el Leonardo Hotel Barcelona Gran Via, y cuenta con amplias zonas comunes cubiertas de mármol.

TV de pantalla plana, WiFi, caja fuerte, escritorio, minibar y baño privado con artículos de aseo.

El hotel goza de una buena ubicación para hacer turismo. Se puede ir a pie al barrio Gótico, a las Ramblas y a los lugares de interés de Montjuic. Los principales distritos financieros de la ciudad también se encuentran cerca.

Las habitaciones disponen de TV vía satélite, WiFi gratuita, aire acondicionado y baño con artículos de aseo gratuitos.

El aparcamiento del establecimiento comporta un suplemento."
24,Alberg Pere Tarrés,"7,5",,Les Corts,3.0,917,"El Albergue Pere Tarrés se encuentra a 10 minutos a pie de la estación de tren Sants y a pocos minutos en metro del centro de Barcelona. El albergue dispone de cocina, restaurante y WiFi gratuita.

Las habitaciones del Pere Tarrés Hostel disponen de baño privado, ropa de cama y taquillas. Las habitaciones dobles incluyen toallas.

El Pere Tarrés sirve un desayuno buffet.

El Albergue Pere Tarrés se encuentra a 5 minutos a pie de la estación de metro María Cristina. El albergue está cerca del centro comercial L'Illa Diagonal y a unos 15 minutos del estadio de fútbol Camp Nou."
25,htop BCN City #htopEnjoy,"6,3",2,Horta,2.7,874,"El htop BCN City se encuentra junto al impresionante hospital de Sant Pau y a 10 minutos a pie de la Sagrada Familia. Ofrece habitaciones con aire acondicionado y TV.

Las habitaciones del htop BCN City presentan una decoración sencilla y disponen de escritorio. Todas tienen baño privado y muchas ofrecen vistas al hospital de Sant Pau.

La recepción del htop BCN City está abierta las 24 horas. Hay wifi gratuita en todas las zonas del hotel.

El hotel cuenta con máquinas expendedoras de aperitivos y bebidas. Hay una gran variedad de restaurantes y bares a 10 minutos a pie.

La estación de metro de Sant Pau Dos de Maig está a solo 200 metros del htop BCN City, lo que le permitirá llegar fácilmente al resto de la ciudad."
26,Hostalin Barcelona Diputacion,"6,5",2,Eixample,1.1,806,"Este moderno establecimiento está ubicado en el elegante barrio del Eixample, a 10 minutos a pie de la basílica de la Sagrada Familia. Ofrece conexión Wi-Fi gratuita y habitaciones con aire acondicionado, algunas con balcón.

Las elegantes habitaciones del Hostalin Barcelona Diputación está situadas en un majestuoso edificio modernista y disponen de suelo de madera, TV de plasma por cable y baño privado con artículos de aseo gratuitos.

El establecimiento ofrece recepción 24 horas con caja fuerte, información turística, consigna de equipaje y servicio de conserjería. Se encuentra a 5 minutos a pie de bares, tiendas y restaurantes.

También está a 10 minutos a pie del animado parque de la Ciutadella y a 15 minutos a pie del paseo de Gracia, que alberga La Pedrera y la Casa Batlló de Gaudí.

El Hostalin Barcelona Diputación está a 150 metros de la estación de metro de Tetuán, que ofrece conexión con la playa de la Barceloneta en unos 15 minutos. La estación de autobuses del Nord está a 8 minutos a pie."
