,Hotel Names,Rating,Stars,Location,Center Distance,Price,Description
448,Breathtaking Castle View Youhosty - Quintino Sella,"8,6",3,Centro de Mil,0.8,1.781,"Breathtaking Castle View Youhosty - Quintino Sella está en el centro de Milán, a 2 min a pie de Castillo Sforzesco y a 1 km de Arena Civica, y ofrece wifi gratis. Este apartamento tiene acceso a una cocina totalmente equipada.

Este apartamento con aire acondicionado consta de 1 dormitorio independiente, 1 baño con secador de pelo y una sala de estar. Hay toallas y ropa de cama en el apartamento.

Cerca del alojamiento hay puntos de interés como La Scala, Pinacoteca de Brera y Galería Vittorio Emanuele. El aeropuerto (Aeropuerto de Milán - Linate) está a 10 km."
449,Locanda Ai Due Orsi,"8,8",3,Mil,6.3,928,"Locanda Ai Due Orsi está en Milán, a 5 km de Porta Romana Metro Station, y tiene restaurante, habitaciones libres de humo y wifi gratis en todo el alojamiento. El alojamiento se encuentra a 6,6 km de Palacio Real, a 6,7 km de Museo Del Novecento y a 7,3 km de Villa Necchi Campiglio. Estación de metro San Babila está a 7,4 km del hostal o pensión y GAM Milano, a 7,7 km.

El hostal o pensión ofrece habitaciones con aire acondicionado, escritorio, hervidor, caja fuerte, TV de pantalla plana y baño privado con bidet. Todas las habitaciones tienen armario.

Galería Vittorio Emanuele está a 8,4 km del alojamiento, y Piazza del Duomo está a 8,5 km. El aeropuerto (Aeropuerto de Milán - Linate) está a 4 km."
450,New Capolinea 5 - Apartment,"9,5",3,Mil,3.9,971,"New Capolinea 5 - Apartment se encuentra en Milán, a 1,7 km de Estación de metro Lambrate y a 3,6 km de Villa Necchi Campiglio, y ofrece alojamiento con equipamiento como wifi gratis y TV de pantalla plana. Este apartamento está a 3,8 km de Estación de metro San Babila y a 4 km de GAM Milano.

Este apartamento con aire acondicionado consta de 1 dormitorio, una sala de estar, una cocina totalmente equipada con nevera y cafetera, y 1 baño con bidet y ducha. Hay toallas y ropa de cama en el apartamento.

Estación de metro Centrale está a 4,2 km del alojamiento, y Montenapoleone Metro Station está a 4,2 km. El aeropuerto (Aeropuerto de Milán - Linate) está a 6 km."
451,Collini Rooms,"8,7",4,Mil,4.9,1.844,"El hotel Collini Rooms, situado en Milán, a menos de 10 minutos en coche del aeropuerto de Milán-Linate, ofrece alojamiento con un restaurante italiano y una terraza panorámica. Hay WiFi gratuita en todas las instalaciones.

Todas las habitaciones del hotel cuentan con aire acondicionado y TV de pantalla plana. El baño privado incluye secador de pelo, artículos de aseo gratuitos y zapatillas.

El Collini Rooms sirve un desayuno buffet con productos dulces y salados todas las mañanas.

El establecimiento está a 5 km del distrito de la moda de Milán y a 200 metros de una parada de tranvía que conecta con la catedral de Milán en unos 25 minutos."
452,Italianway - Favretto 13,"8,1",4,Feria de Mil,3.0,914,"Italianway - Favretto 13 se encuentra en Milán, a 15 min a pie de MUDEC y a 2,5 km de Iglesia de Santa Maria delle Grazie, y ofrece alojamiento con equipamiento como wifi gratis y TV de pantalla plana. Este apartamento está a 2,8 km de Dársena de Milán y a 3,2 km de CityLife.

Este apartamento con aire acondicionado consta de 2 dormitorios, una sala de estar, una zona de cocina totalmente equipada con nevera y cafetera, y 2 baños con bidet y ducha. Hay toallas y ropa de cama en el apartamento.

Fiera Milano está a 3,5 km del alojamiento, y Castillo Sforzesco está a 4 km. El aeropuerto (Aeropuerto de Milán - Linate) está a 12 km."
453,Centro Extra Luxury Appartment with Terrace,"8,8",4,Estaci,1.9,2.422,"Centro Extra Luxury Appartment with Terrace se encuentra en Milán, a 9 min a pie de Estación de metro Centrale y a 1,1 km de GAM Milano, y ofrece alojamiento con wifi gratis, aire acondicionado y terraza. Este apartamento tiene acceso a un balcón.

El apartamento dispone de 2 dormitorios, cocina con nevera, lavadora y 2 baños con secador de pelo. Se ofrece TV de pantalla plana.

Centro Extra Luxury Appartment with Terrace ofrece bañera de hidromasaje.

Cerca del alojamiento hay puntos de interés como Pinacoteca de Brera, Bosco Verticale y Villa Necchi Campiglio. El aeropuerto (Aeropuerto de Milán - Linate) está a 8 km."
454,Novotel Milano Nord Ca' Granda,"7,2",4,Bicocca ,4.7,822,"El Novotel Ca' Granda está situado en Milán y cuenta con piscina al aire libre, restaurante y garaje. El establecimiento se encuentra a solo 400 metros de la nueva estación de metro Ca’ Granda y a menos de 15 minutos en coche de la Expo 2015 y el centro de exposiciones Rho Fiera Milano.

Las habitaciones disponen de WiFi gratuita y aire acondicionado. Todas cuentan con suelo de moqueta, zona de estar con TV vía satélite, minibar y hervidor eléctrico. También disponen de baño totalmente equipado.

El restaurante sirve cocina italiana e internacional y tiene capacidad para 200 comensales. Todas las mañanas se sirve un abundante desayuno buffet a partir de las 06:30.

El Ca’ Granda Novotel alberga un centro de fitness de uso gratuito y un centro de congresos moderno con capacidad para 550 personas. También hay una zona de internet.

El Ca' Granda está situado en el distrito de Bicocca, a 750 metros del hospital Niguarda. El centro histórico de Milán se halla a 5 km y es accesible en metro y tranvía. El aeropuerto de Linate queda a 12 km."
455,Sospeso Boutique Hotel,"8,0",,Centro de Mil,0.8,2.172,"Sospeso Boutique Hotel se encuentra en Milán, a 5 min a pie de Villa Necchi Campiglio, y ofrece habitaciones con vistas a la ciudad y wifi gratis. El alojamiento está cerca de Estación de metro San Babila, de Montenapoleone Metro Station y de La Scala. El alojamiento está a 800 metros del centro de la ciudad y a 8 min a pie de GAM Milano.

El hotel ofrece habitaciones con aire acondicionado, escritorio, cafetera, minibar, caja fuerte, TV de pantalla plana y baño privado con bidet.

Cerca del alojamiento hay puntos de interés como Galería Vittorio Emanuele, Palacio Real y Piazza del Duomo. El aeropuerto (Aeropuerto de Milán - Linate) está a 8 km, y el alojamiento ofrece servicio de traslado de pago para ir o volver del aeropuerto."
456,Bilocale Sforza Milano Centro !!,"9,3",3,Centro de Mil,0.8,1.231,"Bilocale Sforza Milano Centro!! está en el centro de Milán, a solo 9 min a pie de Palacio Real y a 900 metros de Museo Del Novecento, y ofrece alojamiento con vistas a la ciudad y wifi gratis. Este apartamento se encuentra en un edificio de 2021 y está a 14 min a pie de Estación de metro San Babila y a 1,7 km de Montenapoleone Metro Station.

Este apartamento con aire acondicionado consta de 1 dormitorio, una sala de estar, una cocina totalmente equipada con nevera y cafetera, y 1 baño con bidet y ducha. Hay toallas y ropa de cama en el apartamento.

El personal habla tanto inglés como italiano y estará encantado de dar consejos sobre la zona en recepción.

Cerca del alojamiento hay puntos de interés como Porta Romana Metro Station, Galería Vittorio Emanuele y Piazza del Duomo. El aeropuerto (Aeropuerto de Milán - Linate) está a 7 km."
457,Magville,"8,8",4,Mil,2.0,1.895,"Magville está en Milán, a 13 min a pie de Villa Necchi Campiglio, y dispone de alojamiento con jardín, parking privado, salón de uso común y terraza. Este hotel de 4 estrellas ofrece bar. El alojamiento ofrece recepción 24 horas, traslado para ir o volver del aeropuerto, servicio de habitaciones y wifi gratis.

Estación de metro San Babila está a 17 min a pie del alojamiento, y GAM Milano está a 1,4 km. El aeropuerto (Aeropuerto de Milán - Linate) está a 6 km."
458,10 KEYS MILANO,"8,5",4,Porta Vittoria,1.7,1.953,"10 KEYS MILANO está en Milán, a 12 min a pie de Porta Romana Metro Station, y dispone de servicio de conserjería, habitaciones libres de humo, restaurante, wifi gratis y bar. Este hotel de 4 estrellas ofrece servicio de habitaciones y recepción 24 horas. Hay parking privado en el propio alojamiento.

El hotel ofrece habitaciones con aire acondicionado, escritorio, cafetera, nevera, minibar, caja fuerte, TV de pantalla plana y baño privado con bidet. En 10 KEYS MILANO, las habitaciones incluyen ropa de cama y toallas.

El desayuno está disponible cada mañana e incluye opciones buffet, italianas o veganas.

En el alojamiento, la clientela puede disfrutar de baño turco.

Cerca del alojamiento hay puntos de interés como Villa Necchi Campiglio, Palacio Real y Estación de metro San Babila. El aeropuerto (Aeropuerto de Milán - Linate) está a 6 km."
459,Moscova Cosy Apartment,"8,6",4,Centro de Mil,1.5,1.769,"Moscova Cosy Apartment se encuentra en el centro de Milán, a 5 min a pie de Arena Civica y a 1 km de Pinacoteca de Brera, y ofrece wifi gratis. Este apartamento está a 17 min a pie de La Scala y a 1,7 km de Galería Vittorio Emanuele.

Este apartamento con aire acondicionado se compone de 1 dormitorio independiente, una sala de estar, una cocina totalmente equipada con nevera y lavavajillas, y 1 baño. Hay toallas y ropa de cama en el apartamento.

Cerca del alojamiento hay puntos de interés como Castillo Sforzesco, GAM Milano y Bosco Verticale. El aeropuerto (Aeropuerto de Milán - Linate) está a 10 km."
460,CSI Group - Hotel Metropoli,"8,3",3,Estaci,2.9,1.321,"CSI Group - Hotel Metropoli está muy bien situado en el barrio de Central Station Area, Milán, a 6 min a pie de Estación de metro Centrale, a 1,5 km de Bosco Verticale y a 2,8 km de GAM Milano. Todas las opciones de alojamiento de este hotel de 3 estrellas tienen vistas a la ciudad, salón de uso común y bar. Hay wifi gratis y se ofrece parking privado por un suplemento.

El hotel ofrece habitaciones con aire acondicionado, escritorio, hervidor, minibar, caja fuerte, TV de pantalla plana y baño privado con bidet. Las habitaciones incluyen armario.

En recepción se hablan varios idiomas, como inglés, español, italiano y ruso, y el personal ofrece información sobre la zona.

Pinacoteca de Brera está a 2,8 km del alojamiento, y Arena Civica está a 3 km. El aeropuerto (Aeropuerto de Milán - Linate) está a 9 km."
461,Milano Colletta Apartment,"8,0",3,Porta Vittoria,2.7,918,"Milano Colletta Apartment se encuentra en el barrio de Porta Vittoria, en Milán, a 13 min a pie de Porta Romana Metro Station, a 3,2 km de Palacio Real y a 3,2 km de Museo Del Novecento. Este apartamento con vistas a la ciudad y al jardín también tiene wifi gratis.

Este apartamento con aire acondicionado consta de 1 dormitorio, una sala de estar, una cocina totalmente equipada con nevera y hervidor, y 1 baño con bidet y ducha. Hay toallas y ropa de cama en el apartamento.

Villa Necchi Campiglio está a 3,8 km del alojamiento, y Estación de metro San Babila está a 4 km. El aeropuerto (Aeropuerto de Milán - Linate) está a 6 km."
462,Future Apartments,"8,6",4,Bicocca ,3.5,1.781,"Future Apartments está en Milán, a 16 min a pie de Bosco Verticale y a 2 km de Estación de metro Centrale, y ofrece alojamiento con wifi gratis y zona de estar.

El alojamiento tiene aire acondicionado, cocina totalmente equipada y con zona de comedor, TV de pantalla plana y baño privado con bidet, artículos de aseo gratuitos y secador de pelo. También hay nevera, lavavajillas y microondas, además de cafetera y hervidor.

Arena Civica está a 2,8 km del alojamiento, y Pinacoteca de Brera está a 3,4 km. El aeropuerto (Aeropuerto de Milán - Linate) está a 11 km, y el alojamiento ofrece servicio de traslado de pago para ir o volver del aeropuerto."
463,Amazing Flat with Terrace,"9,0",3,San Siro,3.8,1.121,"Amazing Flat with Terrace, que cuenta con vistas a la ciudad, ofrece alojamiento con terraza y balcón a unos 17 min a pie de Fiera Milano. Hay wifi gratis y se ofrece parking privado por un suplemento.

Este apartamento con aire acondicionado consta de 1 dormitorio, una sala de estar, una cocina totalmente equipada con nevera y cafetera, y 1 baño con bidet y ducha. Hay toallas y ropa de cama en el apartamento.

CityLife está a 17 min a pie del alojamiento, y Estadio San Siro está a 1,9 km. El aeropuerto (Aeropuerto de Milán - Linate) está a 13 km, y el alojamiento ofrece servicio de traslado de pago para ir o volver del aeropuerto."
464,BnButler - Govone - Ampio e Luminoso Appartamento con Terrazza,"9,0",4,Sempione,3.8,1.311,"BnButler - Govone - Ampio e Luminoso Appartamento con Terrazza se encuentra en el barrio de Sempione, en Milán, cerca de Fiera Milano. Tiene terraza, wifi gratis y lavadora. Este apartamento está a 2,9 km de CityLife y a 3 km de Arena Civica.

Este apartamento con aire acondicionado consta de 2 dormitorios, una sala de estar, una cocina totalmente equipada con nevera y cafetera, y 2 baños con bidet y ducha. Hay toallas y ropa de cama en el apartamento.

El apartamento ofrece bañera de hidromasaje.

Castillo Sforzesco está a 3,8 km del alojamiento, y Pinacoteca de Brera está a 3,9 km. El aeropuerto (Aeropuerto de Milán - Linate) está a 12 km."
465,Appartamento con terrazza in zona Navigli - Tortona,"9,5",4,Navigli,1.7,1.465,"Appartamento con terrazza in zona Navigli - Tortona está en el barrio de Navigli, en Milán, a 6 min a pie de Dársena de Milán y a 1 km de MUDEC, y ofrece alojamiento equipado con balcón y wifi gratis. Este apartamento ofrece alojamiento con patio.

Este apartamento ofrece acceso directo a una terraza y cuenta con 1 dormitorio. El apartamento tiene aire acondicionado y también dispone de TV de pantalla plana, cocina totalmente equipada con nevera, zona de estar, lavadora y 2 baños con bidet, ducha y bañera.

Cerca del alojamiento hay puntos de interés como Iglesia de Santa Maria delle Grazie, San Maurizio al Monastero Maggiore y Piazza del Duomo. El aeropuerto (Aeropuerto de Milán - Linate) está a 10 km."
466,Hotel Studio Inn Centrale & Milano Urban Padel,"8,5",4,Bicocca ,3.7,1.234,"El Studio Inn Centrale ofrece habitaciones y apartamentos con conexión WiFi gratuita. La estación de tren de Milano Centrale está a 10 minutos y ofrece conexiones con los aeropuertos de Malpensa, Linate y Orio al Serio.

Los alojamientos incluyen aire acondicionado, caja fuerte y TV vía satélite de pantalla plana. El baño privado incluye secador de pelo y artículos de aseo gratuitos.

El establecimiento se encuentra a 10 minutos a pie de la parada de metro Marche y a 2 km de la Piazza Gae Aulenti."
467,GS Brera Home,"8,9",3,Centro de Mil,0.6,1.641,"GS Brera Home ofrece alojamiento con una ubicación ideal en pleno corazón de Milán, y tiene vistas a la ciudad y salón de uso común. Está a 5 min a pie de Castillo Sforzesco y dispone de wifi gratis, además de cocina compartida.

Este apartamento con aire acondicionado consta de 1 dormitorio, una sala de estar, una cocina totalmente equipada con nevera y cafetera, y 1 baño con bidet y ducha. Hay toallas y ropa de cama en el apartamento.

Cerca del alojamiento hay puntos de interés como La Scala, Galería Vittorio Emanuele y Montenapoleone Metro Station. El aeropuerto (Aeropuerto de Milán - Linate) está a 9 km."
468,MagnoliaApartments - 2 Unione Duomo,"9,4",3,Centro de Mil,0.25,1.326,"MagnoliaApartments - 2 Unione Duomo ofrece alojamiento muy bien situado en el centro de Milán y dispone de terraza. Este apartamento ofrece alojamiento con balcón y wifi gratis.

Este apartamento de 1 dormitorio tiene aire acondicionado y ofrece 1 baño con bidet, bañera o ducha y artículos de aseo gratuitos. La cocina está equipada con nevera, lavavajillas y microondas, además de cafetera y hervidor.

Cerca del alojamiento hay puntos de interés como San Maurizio al Monastero Maggiore, Palacio Real y Museo Del Novecento. El aeropuerto (Aeropuerto de Milán - Linate) está a 9 km, y el alojamiento ofrece servicio de traslado de pago para ir o volver del aeropuerto."
469,easyhomes - Central Station,"8,8",4,Estaci,2.7,900,"Easyhomes - Central Station está en Milán, a 5 min a pie de Estación de metro Centrale y a 1,1 km de Bosco Verticale, y ofrece alojamiento con equipamiento como wifi gratis y TV de pantalla plana. Este apartamento está a 2,5 km de GAM Milano y a 2,5 km de Pinacoteca de Brera.

Este apartamento con aire acondicionado consta de 1 dormitorio, una sala de estar, una cocina totalmente equipada con nevera y hervidor, y 1 baño con bidet y ducha. Hay toallas y ropa de cama en el apartamento.

Arena Civica está a 2,7 km del alojamiento, y Villa Necchi Campiglio está a 3 km. El aeropuerto (Aeropuerto de Milán - Linate) está a 8 km."
470,Milano Navigli Apartment - Via Tortona,"9,1",3,Navigli,2.1,1.427,"Milano Navigli Apartment - Via Tortona ofrece alojamiento con aire acondicionado en Milán, a 11 min a pie de Dársena de Milán, a 500 metros de MUDEC y a 1,7 km de Iglesia de Santa Maria delle Grazie. Se ofrece wifi gratis en todo el alojamiento y parking privado en el propio alojamiento.

Cada unidad cuenta con cocina totalmente equipada con mesa de comedor, TV de pantalla plana con canales vía satélite y baño privado con bidet, artículos de aseo gratuitos y secador de pelo. También hay nevera, minibar y fogones, además de cafetera y hervidor.

San Maurizio al Monastero Maggiore está a 1,9 km del alojamiento, y Palacio Real está a 3 km. El aeropuerto (Aeropuerto de Milán - Linate) está a 10 km, y el alojamiento ofrece servicio de traslado de pago para ir o volver del aeropuerto."
471,Zuretti - Central Station,"9,6",3,Estaci,3.4,1.140,"Zuretti - Central Station está en Milán, a 12 min a pie de Estación de metro Centrale y a 1,8 km de Bosco Verticale, y dispone de vistas a la ciudad y wifi gratis.

Algunas unidades están equipadas con aire acondicionado, TV de pantalla plana, lavadora, cafetera y cocina.

Estación de metro Lambrate está a 2,9 km del alojamiento, y Arena Civica está a 3,5 km. El aeropuerto (Aeropuerto de Milán - Linate) está a 9 km."
472,"City Life Milan designed Apartment 4 guest with AC, WiFi and Subway M1",,3,Feria de Mil,2.4,1.375,"City Life Milan designed Apartment 4 guest with AC, WiFi and Subway M1, que tiene vistas al jardín, dispone de alojamiento con balcón y cafetera, y está a unos 8 min a pie de CityLife. Está a 16 min a pie de Iglesia de Santa Maria delle Grazie y ofrece wifi gratis, además de servicio de conserjería.

Este apartamento tiene aire acondicionado y cuenta con 1 dormitorio, TV de pantalla plana por cable, zona de comedor, cocina con nevera y sala de estar. Hay toallas y ropa de cama en el apartamento.

Fiera Milano está a 19 min a pie del alojamiento, y Arena Civica está a 1,9 km. El aeropuerto (Aeropuerto de Milán - Linate) está a 12 km."
473,CX Milan NoM,"8,9",,Mil,7.4,730,"CX Milan NoM se encuentra en Milán, a 5,8 km de Fiera Milano y a 6,6 km de CityLife. Ofrece alojamiento con bar y wifi gratis en todo el alojamiento, además de parking privado gratis. El alojamiento está a unos 7,7 km de Rho Fiera Metro Station, a 8,3 km de Recinto ferial de Milán y a 8,4 km de Castillo Sforzesco. Este alojamiento libre de humo está a 7,5 km de Arena Civica.

El albergue ofrece habitaciones con aire acondicionado, escritorio, caja fuerte, TV de pantalla plana y baño privado con bidet.

En CX Milan NoM se sirve un desayuno continental.

Pinacoteca de Brera está a 8,5 km del alojamiento, y Estadio San Siro está a 8,5 km. El aeropuerto (Aeropuerto de Milán - Linate) está a 16 km."
474,Easylife - Accogliente e moderno bilocale in zona Navigli,"8,5",,Centro de Mil,1.4,1.007,"Easylife - Accogliente e moderno bilocale in zona Navigli ofrece wifi gratis y se encuentra en el centro de Milán, a 7 min a pie de Dársena de Milán y a 1,6 km de Iglesia de Santa Maria delle Grazie. Este apartamento está a 17 min a pie de MUDEC y a 1,8 km de Galería Vittorio Emanuele.

Este apartamento con aire acondicionado consta de 1 dormitorio, una sala de estar, una cocina totalmente equipada con nevera y 1 baño con ducha y artículos de aseo gratuitos. Hay toallas y ropa de cama en el apartamento.

Cerca del alojamiento hay puntos de interés como San Maurizio al Monastero Maggiore, Palacio Real y Museo Del Novecento. El aeropuerto (Aeropuerto de Milán - Linate) está a 9 km."
475,Hotel Brenta Milano,"7,9",2,Ripamonti Corvetto,3.3,846,"El Hotel Brenta Milano se encuentra en el distrito Universidad Bocconi de Milán, a sólo 50 metros de la estación de metro de Brenta. Las habitaciones cuentan con TV LCD vía satélite y conexión inalámbrica a internet.

Este hotel de 2 estrellas está a sólo 5 paradas de metro del Duomo. La Estación Central de Milán también está en la misma línea de metro (línea 3).

La recepción está abierta las 24 horas en el Hotel Brenta. Hay un punto de internet gratuito en el vestíbulo.

Todas las habitaciones están climatizadas y disponen de cuarto de baño con secador de pelo."
476,Hotel Silver Milano,"8,3",4,San Siro,9.4,900,"Hotel Silver Milano se encuentra en Milán, a 8,4 km de Estadio San Siro, y ofrece alojamiento con centro de fitness, parking privado, jardín y restaurante. Este hotel de 4 estrellas ofrece bar. El alojamiento dispone de recepción 24 horas, traslado para ir o volver del aeropuerto, servicio de habitaciones y wifi gratis en todo el alojamiento.

En el hotel, todas las habitaciones cuentan con escritorio. Todas las unidades del alojamiento tienen baño privado con bidet y artículos de aseo gratuitos, además de TV de pantalla plana y aire acondicionado. Algunas de las habitaciones también tienen balcón. Las habitaciones incluyen caja fuerte.

En el alojamiento se puede disfrutar de un desayuno buffet, continental o italiano.

CityLife está a 8,7 km del alojamiento, y MUDEC está a 9 km. El aeropuerto (Aeropuerto de Milán - Linate) está a 19 km."
477,Fifty Eight Suite Milan,"9,3",4,Centro de Mil,0.5,1.883,"Fifty Eight Suite Milan está en el centro de Milán, a 4 min a pie de Montenapoleone Metro Station y a 600 metros de Galería Vittorio Emanuele, y ofrece alojamiento con zona de estar. Hay wifi gratis y se ofrece parking privado por un suplemento.

El alojamiento tiene aire acondicionado, cocina totalmente equipada y con zona de comedor, TV de pantalla plana y baño privado con ducha, artículos de aseo gratuitos y secador de pelo. También hay nevera, lavavajillas y minibar, además de cafetera y hervidor.

Cerca del alojamiento hay puntos de interés como Piazza del Duomo, Duomo Milan y Duomo Metro Station. El aeropuerto (Aeropuerto de Milán - Linate) está a 9 km, y el alojamiento ofrece servicio de traslado de pago para ir o volver del aeropuerto."
478,Hotel Colombia,"8,4",4,Estaci,2.4,1.217,"El Hotel Colombia, situado a solo 5 minutos a pie de la estación de tren de Milán, ofrece un jardín tranquilo donde los huéspedes podrán disfrutar de una bebida del bar. Las habitaciones de estilo minimalista cuentan con aire acondicionado.

Las habitaciones del Colombia Hotel presentan una decoración elegante y disponen de conexión WiFi y TV de pantalla plana con canales internacionales gratuitos. Hay una impresora en el vestíbulo y un punto de conexión a internet.

El Colombia prepara un desayuno buffet abundante, que se puede servir en la habitación bajo petición.

Desde la estación de tren de Milano Centrale salen trenes que enlazan con el centro de exposiciones Expo 2015 y autobuses que van a los aeropuertos de Linate, Orio al Serio y Malpensa. El hotel está a solo 10 minutos a pie de la calle comercial Corso Buenos Aires."
479,YouHosty - 25 Aprile 5,"9,1",3,Estaci,1.9,1.638,"YouHosty - 25 Aprile 5 está en el barrio de Estación Garibaldi, en Milán, a 14 min a pie de Arena Civica y a 1,2 km de Pinacoteca de Brera, y ofrece alojamiento equipado con balcón y wifi gratis. Este apartamento está a 1,8 km de GAM Milano y a 1,7 km de La Scala.

Este apartamento con aire acondicionado se compone de 1 dormitorio independiente, una sala de estar, una cocina totalmente equipada con nevera y lavavajillas, y 1 baño. Hay toallas y ropa de cama en el apartamento.

Cerca del alojamiento hay puntos de interés como Castillo Sforzesco, Bosco Verticale y Estación de metro Centrale. El aeropuerto (Aeropuerto de Milán - Linate) está a 10 km."
480,The Couper Sant'Andrea,"8,5",4,Centro de Mil,0.9,1.854,"The Couper Sant'Andrea es un alojamiento muy bien situado en el centro de Milán que ofrece wifi gratis en todo el alojamiento y salón de uso común. Este alojamiento se encuentra muy cerca de lugares de interés como GAM Milano, Villa Necchi Campiglio y Estación de metro San Babila. Hay vistas a la ciudad.

El hostal o pensión ofrece habitaciones con aire acondicionado, escritorio, cafetera, caja fuerte, TV de pantalla plana y baño privado con ducha. The Couper Sant'Andrea dispone de algunas habitaciones con balcón, y todas tienenhervidor. Las habitaciones incluyen armario.

Cerca del alojamiento hay puntos de interés como Montenapoleone Metro Station, La Scala y Galería Vittorio Emanuele. El aeropuerto (Aeropuerto de Milán - Linate) está a 8 km."
481,Hotel Convertini,"7,8",2,Mil,7.0,726,"El Convertini ofrece un bar, una recepción 24 horas y habitaciones con baño privado y aire acondicionado a 5 minutos a pie del metro de Crescenzago. De ahí salen trenes a las estaciones de Milano Centrale y Porta Garibaldi y al Assago Forum.

El establecimiento se encuentra a 15 minutos a pie del parque Lambro y a unos 9 km del centro de Milán. El hospital San Raffaele queda a 10 minutos en coche."
