,Hotel Names,Rating,Stars,Location,Center Distance,Price,Description
222,Picaflor Art & Rooms,"7,1",3,Mil,4.3,673,"Picaflor Art & Rooms se encuentra en Milán, a 17 min a pie de Fiera Milano, y ofrece vistas al jardín. El alojamiento está a 2,9 km de CityLife, a 3,8 km de Arena Civica y a 4,2 km de Estadio San Siro. El hostal o pensión hipoalergénico cuenta con wifi gratis en todo el alojamiento.

El hostal o pensión ofrece habitaciones con aire acondicionado, escritorio, hervidor, caja fuerte, TV de pantalla plana y baño privado con bidet. Las habitaciones incluyen armario.

Iglesia de Santa Maria delle Grazie está a 5 km del alojamiento, y Castillo Sforzesco está a 5 km. El aeropuerto (Aeropuerto de Milán - Linate) está a 14 km."
223,Downtown Apartments Merlo,"9,3",3,Centro de Mil,0.6,1.380,"Downtown Apartments Merlo ofrece alojamiento con aire acondicionado en el centro de Milán, a 12 min a pie de Villa Necchi Campiglio, a 500 metros de Palacio Real y a 6 min a pie de Museo Del Novecento. Hay wifi gratis en todo el alojamiento.

El alojamiento está equipado con TV de pantalla plana y baño privado con bidet, ducha y secador de pelo. La cocina tiene nevera, lavavajillas y microondas.

Cerca del alojamiento hay puntos de interés como Estación de metro San Babila, Montenapoleone Metro Station y Galería Vittorio Emanuele. El aeropuerto (Aeropuerto de Milán - Linate) está a 7 km."
224,Eurohotel,"7,6",3,Centro de Mil,1.8,1.436,"El Eurohotel está situado en el barrio de Porta Venezia, en pleno centro de Milán y a solo 10 minutos a pie de la Via Montenapoleone. Ocupa un edificio de estilo art nouveau que data de la década de 1920 y que está ubicado en una calle tranquila. Hay conexión WiFi gratuita.

Las habitaciones disponen de aire acondicionado, TV de pantalla plana con canales vía satélite, minibar, caja fuerte para ordenador portátil y baño privado con secador de pelo.

Se ofrece la opción de desayuno italiano, que se puede disfrutar en el jardín cuando hace buen tiempo.

Los huéspedes tienen acceso gratuito a una sala de fitness. Por un suplemento, pueden disfrutar de la zona de bienestar, que incluye sauna, sala de relax y duchas de hidromasaje.

Además, el personal del establecimiento puede ayudar a los huéspedes a organizar su estancia en Milán y a reservar eventos, y también proporciona información sobre los mejores restaurantes y discotecas.

El establecimiento se halla a 250 metros de la estación de metro Porta Venezia. A 3 paradas de esta estación se encuentra la estación central de Milán, que enlaza con el centro de exposiciones Expo 2015 y con el aeropuerto de Malpensa."
225,Hotel The Square Milano Duomo - Preferred Hotels & Resorts,"8,7",4,Centro de Mil,0.4,2.501,"El The Square Milano Duomo Hotel ocupa un edificio histórico situado a 5 minutos a pie de la catedral de Milán, la ópera de la Scala y la zona comercial de Vittorio Emanuele. Ofrece restaurante, bar y WiFi gratuita en todas sus instalaciones.

Las habitaciones son modernas y disponen de aire acondicionado, minibar y baño privado con secador de pelo y artículos de aseo gratuitos.

El Square Milano está a 15 minutos a pie del Parco Sempione y a 100 metros de la parada de metro de Missori."
226,INTOMILAN Galleria Duomo I Boutique & Design Aparthotel,"9,1",4,Centro de Mil,0.5,2.024,"INTOMILAN Galleria Duomo I Boutique & Design Aparthotel ofrece vistas a la ciudad y wifi gratis. Ofrece alojamiento bien situado en el centro de Milán, a poca distancia de Estación de metro San Babila, Montenapoleone Metro Station y Villa Necchi Campiglio.

Cada unidad tiene baño privado, bidet, aire acondicionado, TV de pantalla plana y minibar. Algunas unidades también tienen una cocina equipada con nevera y fogones.

Cerca del alojamiento hay puntos de interés como Galería Vittorio Emanuele, Piazza del Duomo y Duomo Milan. El aeropuerto (Aeropuerto de Milán - Linate) está a 8 km."
227,Garden Bicocca,"7,6",,Viale Monza,7.1,773,"Garden Bicocca se encuentra en Milán y ofrece alojamiento con terraza o balcón, wifi gratis y TV de pantalla plana, además de jardín. Hay parking privado en el propio alojamiento.

También se ofrece nevera, lavavajillas y microondas en la zona de cocina, además de cafetera.

El bed and breakfast ofrece desayuno buffet o italiano.

Garden Bicocca ofrece zona de juegos infantil.

Estación de metro Centrale está a 5,6 km del alojamiento, y Estación de metro Lambrate está a 5,8 km. El aeropuerto (Aeropuerto de Milán - Linate) está a 12 km."
228,UNA HOTELS Scandinavia Milano,"8,3",4,Sempione,3.0,1.338,"Set 200 metres from Gerusalemme Metro Stop with links to Milan city centre, UNA HOTELS Scandinavia Milano offers modern rooms with free WiFi. Guests can also enjoy the gym.

Air-conditioned rooms at the Scandinavia include a flat-screen TV, mahogany wood furnishings, and a minibar. The private bathroom has a hairdryer and aloe toiletries.

Italian and international cuisine are served at Il Giardino Bar & Restaurant by Una Cucina , while you can enjoy drinks and snacks at the lounge bar. An early light breakfast is available daily from 04:00.

The property is 1 km from Milan’s MiCo CityLife Exhibition Centre, while Rho Fiera Milano Exhibition Centre is a 15-minute drive away."
229,Milano Affittacamere,"7,7",3,Viale Monza,3.8,1.106,"Milano Affittacamere está muy bien situado en el barrio de Viale Monza, Milán, a 1,7 km de Estación de metro Centrale, a 2,6 km de Estación de metro Lambrate y a 3 km de GAM Milano. Este alojamiento ofrece cocina compartida y salón de uso común, además de wifi gratis en todo el alojamiento. Hay parking privado en el propio alojamiento.

Todas las unidades incluyen aire acondicionado, nevera, microondas, cafetera, bidet, artículos de aseo gratuitos y escritorio. Todas las habitaciones incluyen baño privado con ducha y secador de pelo. En el hostal o pensión, todas las habitaciones están equipadas con armario y TV de pantalla plana.

Puedes jugar a los dardos en Milano Affittacamere.

Villa Necchi Campiglio está a 3,3 km del alojamiento, y Bosco Verticale está a 3,6 km. El aeropuerto (Aeropuerto de Milán - Linate) está a 8 km."
230,Brera Apartments in San Babila,"8,5",3,Centro de Mil,0.9,1.543,"A 3-minute walk from Piazza San Babila, Brera Apartments in San Babila offers modern and elegantly decorated apartments in central Milan. Facilities include free WiFi access, a flat-screen TV and iPod dock.

Studios and apartments feature elegant furnishings and attention to detail. Each apartment is provided with a comfortable living area. The bathroom comes with a shower, free toiletries and hairdryer."
231,Hotel Vittoria,"8,0",4,Porta Vittoria,1.7,1.296,"El Hotel Vittoria está situado en el distrito milanés de Porta Vittoria, a 100 metros de las paradas de autobús y de tranvía que enlazan con el centro de la ciudad. Ofrece WiFi gratuita en el vestíbulo, así como habitaciones con aire acondicionado y TV de pantalla plana HD.

El Hotel Vittoria, de gestión familiar, dispone de habitaciones acogedoras y elegantes con muebles antiguos. Algunas gozan de vistas al jardín tranquilo. Bajo petición, el desayuno buffet puede incluir zumo de naranjas de Sicilia recién exprimidas. Además, hay productos sin gluten y alimentos kosher disponibles bajo petición.

En el bar del hotel, Il Ritrovo, se pueden servir aperitivos, cócteles internacionales y diversas bebidas. El bar, decorado con cuadros, también organiza sesiones de música en directo por las noches.

El Vittoria se encuentra a 700 metros de la estación de tren de Milán Dateo, que ofrece conexiones con el centro de exposiciones Rho Fiera Milano en 20 minutos."
232,The Corner Duomo Hotel,"8,5",4,Centro de Mil,0.4,3.541,"El Corner Duomo Hotel está situado en el centro de Milán, a solo 3 minutos a pie del Duomo y a pocos pasos del Teatro alla Scala y de la Via Monte Napoleone.

Las habitaciones y suites disponen de aire acondicionado, Smart TV de pantalla plana con canales vía satélite, cafetera Nespresso y wifi gratuita. Algunas suites están equipadas con un spa privado con jacuzzi y sauna.

Las habitaciones y suites disponen de aire acondicionado, Smart TV de pantalla plana con canales vía satélite, cafetera Nespresso y wifi gratuita.

El Corner Duomo Hotel tiene una azotea en la 6.ª planta y una zona de gimnasio."
233,Matilde Boutique Hotel,"9,1",4,Centro de Mil,0.15,3.489,"El Matilde Boutique Hotel dispone de restaurante, bar y salón compartido en Milán, a 150 metros de la Piazza Duomo. También cuenta con recepción 24 horas, servicio de habitaciones y WiFi gratuita en todas las instalaciones. El establecimiento se halla a 1,5 km del lugar donde se encuentra La Última Cena y a 350 metros del Museo del Novecento.

Las habitaciones del Matilde Boutique Hotel incluyen TV vía satélite de pantalla plana, aire acondicionado y baño privado.

El establecimiento sirve un desayuno buffet.

Cerca del Matilde Boutique Hotel hay varios lugares de interés, como la plaza del Duomo, el Teatro de La Scala y la iglesia de San Maurizio al Monastero Maggiore. El aeropuerto de Milán Linate, el más cercano, se sitúa a 10 km."
234,Hotel Marconi,"8,4",4,Estaci,2.1,1.236,"El Hotel Marconi, situado a 500 metros de la estación central de tren de Milán y a 50 metros de la parada de metro más cercana, ofrece habitaciones con canales Sky y aire acondicionado. La zona del vestíbulo cuenta con impresora, terminal con conexión a internet y conexión WiFi gratuitas.

El Marconi Hotel se encuentra en el distrito financiero de Milán, cerca de las tiendas de Corso Buenos Aires y a 15 minutos a pie de la catedral.

Las habitaciones disponen de suelo de parquet elegante y baño privado con cabina de ducha y secador de pelo. El desayuno incluye cruasanes recién hechos y capuchino excelente.

El establecimiento se encuentra a 13 km del centro de exposiciones Expo 2015 y a unos 50 minutos en coche del aeropuerto de Malpensa y del aeropuerto de Orio al Serio."
235,B&B Hotel Milano San Siro,"8,5",3,San Siro,5.4,1.159,"El B&B Hotel Milano San Siro ofrece habitaciones modernas y WiFi gratuita en todas las instalaciones. Se encuentra en Milán, a 5 minutos de la parada de metro Estadio de San Siro y a 15 minutos en coche del Centro de Exposiciones Rho.

Todas las habitaciones tienen aire acondicionado y Smart TV vía satélite con dispositivo Chromecast. El baño privado tiene secador de pelo.

El B&B Hotel Milano San Siro se halla a 3 km del Centro de Exposiciones Fiera Milano City, a 10 minutos en coche del parque Sempione y a 6 km de la catedral de Milán. También se pueden reservar visitas guiadas en la recepción."
236,BMORE Duomo - Luxury Apartments near Duomo,"9,1",4,Centro de Mil,0.1,6.425,"BMORE Duomo - Luxury Apartments near Duomo está en el centro de Milán, a 2 min a pie de Piazza del Duomo y a 200 metros de Duomo Milan, y ofrece alojamiento con zona de estar. Hay wifi gratis y se ofrece parking privado por un suplemento.

Las unidades están equipadas con balcón y ofrecen aire acondicionado, TV de pantalla plana y baño privado con ducha y artículos de aseo gratuitos. También hay nevera, lavavajillas y microondas en la cocina, además de cafetera.

En el apartamento se sirve todas las mañanas un desayuno italiano.

Cerca del alojamiento hay puntos de interés como Duomo Metro Station, Galería Vittorio Emanuele y Montenapoleone Metro Station. El aeropuerto (Aeropuerto de Milán - Linate) está a 9 km."
237,Bed Milano Linate,"9,2",3,Porta Vittoria,3.9,1.032,"El Bed Milano Linate se encuentra a 500 metros de la estación de tren de Forlanini, en Milán, que ofrece conexiones con el centro de la ciudad y el centro de exposiciones RhoFiera. Dispone de habitaciones con aire acondicionado y conexión WiFi gratuita.

Las habitaciones del Bed Milano Linate están equipadas con TV de pantalla plana y baño privado con artículos de aseo gratuitos y secador de pelo.

Este establecimiento se encuentra a 3,6 km del distrito de la moda de Milán, a 3,8 km de la catedral de Milán y a 3 km del aeropuerto de Linate, el más cercano."
238,INNSiDE by Meliá Milano Torre GalFa,"8,9",4,Estaci,2.5,1.633,"El INNSiDE by Melia Milano Torre GalFa está ubicado en Milán, a solo 250 metros de la estación de tren Milano Centrale, y cuenta con restaurante, bar, salón común y gimnasio con sistema InFit®. Además, este hotel de 4 estrellas ofrece habitaciones con aire acondicionado, WiFi gratuita, dispositivo Chromecast y baño privado.

El hotel gestiona las primeras 12 plantas de la emblemática Torre GalfA y cuenta con recepción 24 horas, servicio de habitaciones y consigna de equipaje. 

El hotel sirve un desayuno buffet a diario. El bar propone cócteles exclusivos y organiza conciertos en directo.

El INNSiDE by Melia Milano Torre GalFa se encuentra a menos de 1 km del complejo residencial Bosco Verticale y a 2 km del cementerio monumental. El aeropuerto de Milán-Linate, situado a 10 km, es el más cercano. Se proporciona un servicio de enlace con el aeropuerto por un suplemento."
239,Ca' Monteggia Guest House,"9,0",,Centro de Mil,0.5,1.706,"El Ca' Monteggia es un establecimiento situado en el corazón de Milán, en un edificio histórico que fue el hogar del Dr. Giovan Battista Monteggia. Se encuentra junto a la Universidad de Milán y a 350 metros de la catedral de Milán.

Las habitaciones disponen de WiFi gratuita, aire acondicionado, TV de pantalla plana, caja fuerte y minibar. El baño privado incluye bañera o ducha, artículos de aseo gratuitos y secador de pelo.

El desayuno se sirve en la zona común bajo petición.

El Ca' Monteggia se encuentra a 5 minutos a pie de la parada de metro Missori y a 600 metros de la parada de metro Duomo. Se ofrecen descuentos en un aparcamiento asociado cercano."
240,Sonder Manzoni,"9,2",3,Centro de Mil,0.8,1.583,"Sonder Manzoni ofrece alojamiento con aire acondicionado en el centro de Milán, a 8 min a pie de Palacio Real, a 800 metros de Museo Del Novecento y a 13 min a pie de Porta Romana Metro Station. Hay wifi gratis.

Cada unidad cuenta con cocina totalmente equipada con mesa de comedor, TV de pantalla plana con canales por cable y baño privado con bañera o ducha, artículos de aseo gratuitos y secador de pelo. También se ofrece nevera, microondas y fogones, además de cafetera y hervidor.

Cerca del alojamiento hay puntos de interés como Estación de metro San Babila, San Maurizio al Monastero Maggiore y Galería Vittorio Emanuele. El aeropuerto (Aeropuerto de Milán - Linate) está a 7 km."
241,Bellezza14 - Appartamento Porta Romana / Bocconi,"9,2",4,Mil,1.8,2.611,"Bellezza14 - Appartamento Porta Romana / Bocconi se encuentra en Milán y ofrece alojamiento con balcón y wifi gratis. El alojamiento ofrece vistas al jardín y está a 10 min a pie de Porta Romana Metro Station y a 1,8 km de Dársena de Milán.

Este apartamento con aire acondicionado se compone de 3 dormitorios y 2 baños con bidet, ducha y secador de pelo. La cocina está equipada con nevera, lavavajillas y horno, además de cafetera y hervidor.

Palacio Real está a 1,9 km del alojamiento, y Museo Del Novecento está a 2,6 km. El aeropuerto (Aeropuerto de Milán - Linate) está a 8 km."
242,Hotel Giacosa,"8,0",3,Viale Monza,4.0,674,"Hotel Giacosa, que tiene bar, está en la región de Lombardía, Milán, a 1,7 km de Estación de metro Lambrate y a 2,5 km de Estación de metro Centrale. Este hotel de 3 estrellas ofrece salón de uso común y habitaciones con aire acondicionado, wifi gratis y baño privado. Hay parking privado en el propio alojamiento.

En el hotel, cada habitación dispone de escritorio y TV de pantalla plana. Todas las habitaciones incluyen caja fuerte, algunas ofrecen balcón y otras también tienen vistas a la ciudad. En Hotel Giacosa, todas las habitaciones cuentan con ropa de cama y toallas.

El desayuno ofrece opciones buffet, continentales o italianas.

El personal habla árabe, inglés, italiano y filipino, y estará encantado de dar consejos sobre la zona en recepción.

GAM Milano está a 3,1 km del alojamiento, y Villa Necchi Campiglio está a 3,4 km. El aeropuerto (Aeropuerto de Milán - Linate) está a 8 km."
243,BePlace Garibaldi Suites,"8,3",3,Centro de Mil,1.4,1.207,"BePlace Garibaldi Suites dispone de vistas a la ciudad y wifi gratis. Ofrece alojamiento con una ubicación ideal en el centro de Milán, a poca distancia de Pinacoteca de Brera, Arena Civica y Castillo Sforzesco.

El alojamiento tiene aire acondicionado, zona de cocina totalmente equipada y con zona de comedor, TV de pantalla plana y baño privado con bidet, artículos de aseo gratuitos y secador de pelo. También hay nevera, fogones y cafetera.

Cerca del alojamiento hay puntos de interés como GAM Milano, La Scala y Galería Vittorio Emanuele. El aeropuerto (Aeropuerto de Milán - Linate) está a 9 km, y el alojamiento ofrece servicio de traslado de pago para ir o volver del aeropuerto."
244,MPM-Attico in Piazza Duomo,"9,0",4,Centro de Mil,0.15,2.678,"MPM-Attico in Piazza Duomo es un alojamiento muy bien situado en el centro de Milán que ofrece balcón. Este apartamento ofrece wifi gratis y se encuentra a 4 min a pie de Palacio Real y a 400 metros de Museo Del Novecento.

Este apartamento con aire acondicionado consta de 1 dormitorio, una sala de estar, una cocina totalmente equipada con nevera y cafetera, y 1 baño con bidet y artículos de aseo gratuitos. Hay toallas y ropa de cama en el apartamento.

Cerca del alojamiento hay puntos de interés como San Maurizio al Monastero Maggiore, Estación de metro San Babila y Montenapoleone Metro Station. El aeropuerto (Aeropuerto de Milán - Linate) está a 8 km, y el alojamiento ofrece servicio de traslado de pago para ir o volver del aeropuerto."
245,Prestige Boutique Homes-Duomo,"8,7",3,Centro de Mil,0.4,1.896,"Prestige Boutique Homes-Duomo, que cuenta con terraza y wifi gratis, se encuentra en el centro de Milán, cerca de Estación de metro San Babila, Montenapoleone Metro Station y Galería Vittorio Emanuele.

El alojamiento tiene aire acondicionado, zona de cocina totalmente equipada, TV de pantalla plana y baño privado con bidet, artículos de aseo gratuitos y secador de pelo. También se ofrece nevera y lavavajillas, además de cafetera y hervidor.

Cerca del alojamiento hay puntos de interés como Piazza del Duomo, Duomo Milan y Duomo Metro Station. El aeropuerto (Aeropuerto de Milán - Linate) está a 8 km."
246,Canova Hotel,"8,0",3,Estaci,2.3,1.279,"El Canova Hotel, de 3 estrellas, se encuentra a solo 200 metros de la estación de tren y metro Milano Centrale, y ofrece habitaciones con conexión WiFi gratuita y TV vía satélite de pantalla plana. El Duomo de Milán está a 4 paradas de metro.

Las habitaciones del Canova disponen de muebles sencillos, aire acondicionado, minibar y ventana con vistas a las calles de los alrededores.

El hotel se encuentra en una zona llena de bares y restaurantes, a 5 minutos a pie de la calle comercial Corso Buenos Aires, y también está cerca de las paradas de los autobuses que comunican con los aeropuertos de Malpensa y Linate (frente a la estación central).

La Rho Fiera Milano y el centro de exposiciones Expo 2015 están a 15 km del Canova Hotel."
247,HD8 Hotel Milano,"8,3",4,Estaci,2.5,1.202,"HD8 Hotel Milano está muy bien situado en el barrio de Central Station Area, Milán, a 14 min a pie de Bosco Verticale, a 1,6 km de GAM Milano y a 2,3 km de Villa Necchi Campiglio. Este hotel de 4 estrellas tiene wifi gratis, recepción 24 horas y servicio de conserjería. Este alojamiento hipoalergénico está a pocos pasos de Estación de metro Centrale.

En el hotel, las habitaciones disponen de escritorio. Las unidades del alojamiento tienen baño privado con bidet y artículos de aseo gratuitos, además de TV de pantalla plana y aire acondicionado. Algunas habitaciones también ofrecen balcón. En HD8 Hotel Milano, las habitaciones están equipadas con ropa de cama y toallas.

El desayuno está disponible e incluye opciones buffet, continentales o italianas.

Pinacoteca de Brera está a 2,7 km del alojamiento, y Estación de metro San Babila está a 2,8 km. El aeropuerto (Aeropuerto de Milán - Linate) está a 8 km."
248,UNA HOTELS Hotel & Residence Contessa Jolanda Milano,"7,3",4,Mil,3.8,966,"El UNA HOTELS Hotel & Residence Contessa Jolanda Milano está ubicado en la zona norte de Milán, a 5 minutos a pie de la estación de metro Maciachini, y ofrece acceso gratuito a su zona de fitness cubierta.

La sala de desayunos del establecimiento se llama Aquarius, está situada en la 8ª planta y tiene vistas panorámicas a Milán. Los huéspedes también pueden disfrutar de un servicio de entrega de comida en las habitaciones.

El UNA HOTELS Hotel & Residence Contessa Jolanda Milano ofrece habitaciones y apartamentos, queda cerca del centro de la ciudad y está muy bien comunicado con los principales servicios de transporte público, por lo que es ideal para huéspedes en estancias tanto de ocio como de negocios.

Hay servicio de enlace de ida y vuelta con los aeropuertos de Linate y Malpensa, bajo petición y por un suplemento. El UNA HOTELS Hotel & Residence Contessa Jolanda Milano se encuentra a unos 15 km de los centros de exposiciones Rho Fiera Milano y Expo."
249,NEW AMAZING MONO LOCATED IN MOSCOVA DISTRICT from Moscova Suites apartments group,"8,4",3,Centro de Mil,1.8,1.481,"NEW AMAZING MONO LOCATED IN MOSCOVA DISTRICT from Moscova Suites apartments group ofrece alojamiento con una buena ubicación en el centro de Milán, a poca distancia de Pinacoteca de Brera y Bosco Verticale. Hay wifi gratis y se ofrece parking privado por un suplemento.

Este apartamento con aire acondicionado se compone de 1 dormitorio independiente, una cocina totalmente equipada con nevera y fogones, y 1 baño. Hay toallas y ropa de cama en el apartamento.

Cerca del alojamiento hay puntos de interés como Arena Civica, Estación de metro Centrale y GAM Milano. El aeropuerto (Aeropuerto de Milán - Linate) está a 9 km."
250,Hotel Wagner,"7,6",4,Feria de Mil,2.8,974,"El Hotel Wagner se encuentra a 4 minutos a pie de la estación de metro de Wagner, con enlaces a la catedral de Milán y el centro de exposiciones Expo 2015, a 16 km.

Todas las habitaciones cuentan con aire acondicionado, TV vía satélite y minibar. El baño privado incluye secador de pelo y artículos de aseo gratuitos.

Las instalaciones incluyen bar, recepción abierta las 24 horas, consigna de equipaje y servicio de lavandería."
251,Best Western Hotel Major,"8,1",4,Mil,2.5,945,"Este establecimiento ofrece el riguroso programa Special Protection, con medidas específicas para garantizar la seguridad de los huéspedes y del personal.

El Best Western Hotel Major está ubicado en el distrito de Porta Romana, junto a la estación de metro Lodi TIBB (línea amarilla), a las afueras de la zona C de Milán (zona de tráfico restringido). Ofrece aparcamiento privado (es obligatorio reservar), wifi gratuita en todas las instalaciones y habitaciones con aire acondicionado.

Todas las habitaciones cuentan con TV vía satélite con canales Sky, caja fuerte y set de té y café. Algunas también incluyen bañera de hidromasaje. Todas las habitaciones son para no fumadores y no tienen suelo de moqueta. La zona de internet del vestíbulo cuenta con impresora y escáner.

El bar sirve bebidas durante todo el día. Hay numerosos restaurantes de calidad en el barrio.

El Hotel Major se encuentra a 15 minutos a pie de la Universidad Bocconi y del Museo de la Fundación Prada. La estación de tren de Milán-Porta Romana queda a solo 200 metros. Está muy bien comunicado por metro con el centro histórico de Milán y con el centro de exposiciones Fiera Milano."
252,Madeleine apartments - Brera,"9,1",4,Centro de Mil,1.3,1.583,"Madeleine apartments - Brera ofrece alojamiento con aire acondicionado en el centro de Milán, a 9 min a pie de Arena Civica, a 700 metros de Pinacoteca de Brera y a 10 min a pie de Castillo Sforzesco. Se ofrece wifi gratis en todo el alojamiento.

Cada unidad cuenta con cocina totalmente equipada con mesa de comedor, TV de pantalla plana con canales vía satélite y baño privado con bidet, artículos de aseo gratuitos y secador de pelo. También hay nevera, lavavajillas y horno, además de cafetera y hervidor.

Cerca del alojamiento hay puntos de interés como La Scala, Bosco Verticale y Galería Vittorio Emanuele. El aeropuerto (Aeropuerto de Milán - Linate) está a 10 km."
253,Hotel Terminal,"7,6",3,Estaci,3.2,893,"El Hotel Terminal está a solo 550 metros de la estación central de Milán, que comunica en tren y metro con toda la ciudad. El Duomo y los recintos feriales quedan a 10 minutos en metro.

La calle comercial Corso Buenos Aires se encuentra en 10 minutos a pie del hotel, y a solo 8 minutos a pie se pueden encontrar las paradas de metro, autobús, tranvía y tren que enlazan con el resto de zonas de Milán.

Las habitaciones son amplias y están equipadas con WiFi gratuita, aire acondicionado, TV vía satélite, minibar y caja fuerte. El amable personal del establecimiento Terminal está disponible las 24 horas del día.

Hay un bar que sirve bebidas, y en la zona hay varios restaurantes."
