,Hotel Names,Rating,Stars,Location,Center Distance,Price,Description
727,Luxury House - Foppa61,"9,7",4,Navigli,2.9,1.678,"Luxury House - Foppa61 se encuentra en el barrio de Navigli, en Milán, cerca de MUDEC. Tiene salón de uso común, wifi gratis y lavadora. Este apartamento está a 2,3 km de Iglesia de Santa Maria delle Grazie y a 2,4 km de Dársena de Milán.

Este apartamento con aire acondicionado consta de 2 dormitorios, una sala de estar, una cocina totalmente equipada con nevera y hervidor, y 2 baños con bidet y ducha. Hay toallas y ropa de cama en el apartamento.

CityLife está a 3,2 km del alojamiento, y Castillo Sforzesco está a 3,9 km. El aeropuerto (Aeropuerto de Milán - Linate) está a 11 km."
728,Inna Best House,"9,6",3,Mil,4.8,6.300,"Inna Best House se encuentra en Milán y ofrece alojamiento a 3,4 km de Bosco Verticale y a 3,9 km de Estación de metro Centrale. Hay wifi gratis en todo el alojamiento.

El alojamiento tiene aire acondicionado, cocina totalmente equipada y con zona de comedor, TV de pantalla plana y baño privado con ducha, artículos de aseo gratuitos y secador de pelo. También se ofrece nevera, horno y microondas, además de cafetera y hervidor.

Arena Civica está a 3,9 km del alojamiento, y Pinacoteca de Brera está a 4,5 km. El aeropuerto (Aeropuerto de Milán - Linate) está a 12 km."
729,Park Hyatt Milano,"9,2",5,Centro de Mil,0.15,7.798,"El Park Hyatt Milano está situado frente a la entrada de las galerías Vittorio Emanuele, en pleno distrito de la moda, y a 200 metros de la catedral y del teatro La Scala. Este hotel cuenta con WiFi gratuita, spa y gimnasio.

Las habitaciones del Park Hyatt presentan un diseño de lujo, son amplias y disponen de baño de mármol espacioso. Algunas tienen terraza privada con vistas al perfil urbano de la ciudad.

Los huéspedes pueden tomar una copa y relajarse en el Mio Lab o probar la oferta gastronómica internacional de La Cupola durante todo el día.

El Park Hyatt Milano está a 2 minutos a pie de la parada de metro Duomo."
730,VivimiHome - Alexander Suite Milano,,4,Sempione,3.9,1.112,"VivimiHome - Alexander Suite Milano es un alojamiento con wifi gratis y vistas a la ciudad que está en Milán, a solo 17 min a pie de Fiera Milano. Este apartamento está a 2,9 km de CityLife y a 3,2 km de Arena Civica.

Este apartamento con aire acondicionado consta de 1 dormitorio, una sala de estar, una cocina totalmente equipada con nevera y cafetera, y 1 baño con bidet y ducha. Hay toallas y ropa de cama en el apartamento.

Castillo Sforzesco está a 4 km del alojamiento, y Pinacoteca de Brera está a 4,1 km. El aeropuerto (Aeropuerto de Milán - Linate) está a 12 km."
731,Loft Luxury Design- Apt with 2 bedrooms -WIFI ULTRA-5min METRO,"8,8",4,Mil,4.8,1.144,"Loft Luxury Design- Apt with 2 bedrooms -WIFI ULTRA-5min METRO está a 4,5 km de Fiera Milano y dispone de alojamiento en Milán con acceso a una bañera de hidromasaje. Este apartamento ofrece wifi gratis y se encuentra a 4,5 km de Bosco Verticale y a 4,9 km de Estación de metro Centrale.

Este apartamento con aire acondicionado consta de 2 dormitorios, una sala de estar, una cocina totalmente equipada con nevera y cafetera, y 2 baños con bidet y ducha. Hay toallas y ropa de cama en el apartamento.

Arena Civica está a 4,9 km del alojamiento, y CityLife está a 5,2 km. El aeropuerto (Aeropuerto de Milán - Linate) está a 13 km, y el alojamiento ofrece servicio de traslado de pago para ir o volver del aeropuerto."
732,Luminosa e spaziosa dimora nel centro di Milano,"8,3",,Centro de Mil,0.6,1.599,"Luminosa e spaziosa dimora nel centro di Milano ofrece wifi gratis y está en el centro de Milán, a 6 min a pie de San Maurizio al Monastero Maggiore y a 1,1 km de Palacio Real. Este apartamento está a 12 min a pie de La Scala y a 1 km de Galería Vittorio Emanuele.

Este apartamento consta de 2 dormitorios independientes, 2 baños y una sala de estar.

Cerca del alojamiento hay puntos de interés como Iglesia de Santa Maria delle Grazie, Museo Del Novecento y Castillo Sforzesco. El aeropuerto (Aeropuerto de Milán - Linate) está a 9 km."
733,E-Milan Rooms Zona Tortona,"8,8",3,Navigli,1.9,1.131,"E-Milan Rooms Zona Tortona está en el barrio de Navigli, en Milán, a 10 min a pie de MUDEC, a 1,4 km de Iglesia de Santa Maria delle Grazie y a 19 min a pie de San Maurizio al Monastero Maggiore. Se encuentra a 11 min a pie de Dársena de Milán y ofrece wifi gratis, además de servicio de conserjería.

Este apartamento tiene aire acondicionado y dispone de 1 dormitorio y 1 baño con bidet, ducha y artículos de aseo gratuitos. La cocina está equipada con nevera, horno y microondas, además de cafetera y hervidor.

Palacio Real está a 2,6 km del alojamiento, y Museo Del Novecento está a 2,6 km. El aeropuerto (Aeropuerto de Milán - Linate) está a 10 km, y el alojamiento ofrece servicio de traslado de pago para ir o volver del aeropuerto."
734,Mansarda Brera,"8,2",3,Centro de Mil,0.9,1.551,"Mansarda Brera se encuentra en el centro de Milán, a 7 min a pie de Castillo Sforzesco y a 900 metros de La Scala, y ofrece aire acondicionado. Se ofrece parking privado por un suplemento.

El apartamento cuenta con TV de pantalla plana. El alojamiento ofrece zona de cocina.

Cerca del alojamiento hay puntos de interés como Galería Vittorio Emanuele, Montenapoleone Metro Station y Piazza del Duomo. El aeropuerto (Aeropuerto de Milán - Linate) está a 10 km."
735,Brera Apartments in Porta Romana,"8,7",3,Porta Vittoria,2.0,1.107,"Brera Apartments in Porta Romana está en Milán, a 14 min a pie de Porta Romana Metro Station y a 1,8 km de Villa Necchi Campiglio, y ofrece alojamiento con wifi gratis y zona de estar.

El alojamiento tiene aire acondicionado, cocina totalmente equipada y con zona de comedor, TV de pantalla plana y baño privado con bidet, artículos de aseo gratuitos y secador de pelo. También hay nevera y microondas, además de cafetera.

Palacio Real está a 1,9 km del alojamiento, y Estación de metro San Babila está a 1,8 km. El aeropuerto (Aeropuerto de Milán - Linate) está a 6 km, y el alojamiento ofrece servicio de traslado de pago para ir o volver del aeropuerto."
736,Milano Experience Home - Gauguin,"9,0",3,Porta Vittoria,2.3,1.938,"Milano Experience Home - Gauguin se encuentra en Milán, a 18 min a pie de Porta Romana Metro Station y a 2,8 km de Villa Necchi Campiglio, y ofrece alojamiento con equipamiento como wifi gratis y TV de pantalla plana. Este apartamento está a 2,9 km de Palacio Real y a 2,9 km de Estación de metro San Babila.

Este apartamento con aire acondicionado consta de 1 dormitorio, una sala de estar, una cocina totalmente equipada con nevera y cafetera, y 1 baño con bidet y ducha. Hay toallas y ropa de cama en el apartamento.

Museo Del Novecento está a 2,9 km del alojamiento, y GAM Milano está a 3,4 km. El aeropuerto (Aeropuerto de Milán - Linate) está a 5 km."
737,[VISTA DUOMO] Attico in Centro • METRO a 2 minuti,"8,2",4,Porta Vittoria,1.7,1.588,"[VISTA DUOMO] Attico in Centro • METRO a 2 minuti, que tiene vistas a la ciudad, dispone de alojamiento con terraza y balcón a unos 11 min a pie de Villa Necchi Campiglio. Este apartamento con vistas a la montaña y al jardín también dispone de wifi gratis.

Este apartamento con aire acondicionado consta de 1 dormitorio, una sala de estar, una cocina totalmente equipada con nevera y cafetera, y 1 baño con bidet y ducha. Hay toallas y ropa de cama en el apartamento.

Cerca del alojamiento hay puntos de interés como Estación de metro San Babila, Montenapoleone Metro Station y Palacio Real. El aeropuerto (Aeropuerto de Milán - Linate) está a 6 km."
738,REGINA by The Blue Twins apartments Milano,"9,6",4,Estaci,2.0,2.295,"REGINA by The Blue Twins apartments Milano es un alojamiento con vistas a la ciudad que está en Milán, a 6 min a pie de Bosco Verticale y a 1,3 km de Estación de metro Centrale. Hay wifi gratis y se ofrece parking privado por un suplemento.

Este apartamento con aire acondicionado consta de 1 dormitorio, una sala de estar, una cocina totalmente equipada con nevera y cafetera, y 1 baño con bidet y ducha. Hay toallas y ropa de cama en el apartamento.

Cerca del alojamiento hay puntos de interés como Arena Civica, Pinacoteca de Brera y GAM Milano. El aeropuerto (Aeropuerto de Milán - Linate) está a 9 km."
739,Casa da Suite Lukema,"6,4",3,Mil,4.5,912,"Casa da Suite Lukema se encuentra a 3,5 km de Bosco Verticale y ofrece alojamiento con balcón y wifi gratis.

El alojamiento tiene aire acondicionado, cocina totalmente equipada y con zona de comedor, TV de pantalla plana y baño privado con bidet, artículos de aseo gratuitos y secador de pelo. También se ofrece nevera, horno y microondas, además de cafetera y hervidor.

Estación de metro Centrale está a 3,9 km del alojamiento, y Arena Civica está a 4 km. El aeropuerto (Aeropuerto de Milán - Linate) está a 12 km, y el alojamiento ofrece servicio de traslado de pago para ir o volver del aeropuerto."
740,Il Giardino Garden View Apartment,"9,6",4,Feria de Mil,2.0,1.268,"Il Giardino Garden View Apartment se encuentra en Milán, a 8 min a pie de Iglesia de Santa Maria delle Grazie y a 1,6 km de CityLife, y ofrece alojamiento con wifi gratis, aire acondicionado, jardín y terraza. El alojamiento, que dispone de patio, se construyó en 1900.

El apartamento cuenta con 1 dormitorio, 1 baño, ropa de cama, toallas, TV de pantalla plana con canales por cable, zona de comedor, cocina totalmente equipada y balcón con vistas al jardín.

Castillo Sforzesco está a 1,7 km del alojamiento, y Dársena de Milán está a 2,3 km. El aeropuerto (Aeropuerto de Milán - Linate) está a 11 km."
741,Italianway - Torino 66,"8,2",3,Centro de Mil,0.6,1.031,"Italianway - Torino 66 es un alojamiento con una ubicación excelente en el centro de Milán que ofrece balcón. San Maurizio al Monastero Maggiore y Palacio Real están a 8 min a pie y a 900 metros del apartamento, y hay wifi gratis.

Este apartamento con aire acondicionado consta de 1 dormitorio, una sala de estar, una zona de cocina totalmente equipada con nevera y cafetera, y 1 baño con bidet y artículos de aseo gratuitos. Hay toallas y ropa de cama en el apartamento.

Cerca del alojamiento hay puntos de interés como Museo Del Novecento, Dársena de Milán y Castillo Sforzesco. El aeropuerto (Aeropuerto de Milán - Linate) está a 9 km."
742,Contempora Apartments - Cavallotti 13 - B12,"8,4",3,Centro de Mil,0.6,1.952,"Contempora Apartments - Cavallotti 13 - B12 se encuentra en el centro de Milán, a 6 min a pie de Palacio Real y a 600 metros de Museo Del Novecento, y ofrece wifi gratis. Este apartamento está a 8 min a pie de Galería Vittorio Emanuele y a 700 metros de Piazza del Duomo.

Este apartamento con aire acondicionado se compone de 1 dormitorio y 2 baños con bidet, ducha y secador de pelo. El alojamiento tiene una cocina con nevera y fogones.

Cerca del alojamiento hay puntos de interés como Villa Necchi Campiglio, Estación de metro San Babila y Montenapoleone Metro Station. El aeropuerto (Aeropuerto de Milán - Linate) está a 7 km."
743,Bourgie Apartment,"8,8",3,Estaci,2.7,1.699,"Bourgie Apartment es un alojamiento con wifi gratis y vistas a la ciudad que está en Milán, a solo 10 min a pie de Estación de metro Centrale y a 1,6 km de GAM Milano. Este apartamento se encuentra en un edificio de 2022 y está a 2 km de Bosco Verticale y a 2,3 km de Estación de metro Lambrate.

Este apartamento de 1 dormitorio tiene aire acondicionado y ofrece 1 baño con bidet, ducha y artículos de aseo gratuitos. La cocina está equipada con nevera, lavavajillas y horno, además de cafetera y hervidor.

Villa Necchi Campiglio está a 1,9 km del alojamiento, y Estación de metro San Babila está a 2,8 km. El aeropuerto (Aeropuerto de Milán - Linate) está a 7 km."
744,B&B San Siro 139,"8,8",3,San Siro,5.8,1.418,"B&B San Siro 139, que se encuentra a 15 min a pie de Estadio San Siro y a 3,5 km de Fiera Milano, ofrece habitaciones con aire acondicionado y baño privado en Milán. El hostal o pensión tiene wifi gratis y está a unos 5,4 km de Iglesia de Santa Maria delle Grazie y a 6 km de MUDEC. Este alojamiento libre de humo está a 4 km de CityLife.

En el hostal o pensión, todas las habitaciones están equipadas con escritorio, TV de pantalla plana, baño privado, ropa de cama y toallas. Todas las unidades cuentan con nevera.

Arena Civica está a 6,3 km del alojamiento, y Castillo Sforzesco está a 6,5 km. El aeropuerto (Aeropuerto de Milán - Linate) está a 15 km."
745,Garibaldi 64 - Luxury apartment in Brera district,"8,7",4,Centro de Mil,1.3,1.506,"Garibaldi 64 - Luxury apartment in Brera district ofrece alojamiento bien situado en el centro de Milán y tiene terraza. Arena Civica y Pinacoteca de Brera están a 10 min a pie y a 700 metros del apartamento, y hay wifi gratis.

Este apartamento de 1 dormitorio tiene aire acondicionado y ofrece 1 baño con bidet, ducha y secador de pelo. La zona de cocina está equipada con nevera, horno y microondas, además de cafetera y hervidor.

Cerca del alojamiento hay puntos de interés como Castillo Sforzesco, La Scala y Bosco Verticale. El aeropuerto (Aeropuerto de Milán - Linate) está a 10 km."
746,AMAZING NEW SUITE WITH BEAUTIFUL VIEW from Moscova Suites apartments group,"8,3",4,Centro de Mil,1.8,2.804,"AMAZING NEW SUITE WITH BEAUTIFUL VIEW from Moscova Suites apartments group está en el centro de Milán, a 13 min a pie de Arena Civica y a 1,1 km de Pinacoteca de Brera, y ofrece alojamiento con vistas a la ciudad. Hay wifi gratis y se ofrece parking privado por un suplemento.

Este apartamento con aire acondicionado consta de 1 dormitorio, una sala de estar, una cocina totalmente equipada con nevera y cafetera, y 1 baño con bidet y ducha. Hay toallas y ropa de cama en el apartamento.

Cerca del alojamiento hay puntos de interés como Castillo Sforzesco, Bosco Verticale y Estación de metro Centrale. El aeropuerto (Aeropuerto de Milán - Linate) está a 10 km."
747,Tortona Sky Loft,"7,0",3,Mil,3.1,1.210,"Tortona Sky Loft, que tiene vistas a la ciudad, dispone de alojamiento con terraza y balcón a unos 11 min a pie de MUDEC. Este apartamento ofrece wifi gratis y está a 2,4 km de Dársena de Milán y a 3 km de Iglesia de Santa Maria delle Grazie.

Este apartamento con aire acondicionado consta de 2 dormitorios, una sala de estar, una cocina totalmente equipada con nevera y cafetera, y 2 baños con bidet y ducha. Hay toallas y ropa de cama en el apartamento.

CityLife está a 3,9 km del alojamiento, y San Maurizio al Monastero Maggiore está a 4 km. El aeropuerto (Aeropuerto de Milán - Linate) está a 11 km."
748,JOIVY Elegant flat in Corso Buenos Aires,"8,7",4,Estaci,3.2,2.076,"JOIVY Elegant flat in Corso Buenos Aires, que cuenta con vistas a la ciudad, ofrece alojamiento con terraza y balcón a unos 15 min a pie de Estación de metro Centrale. El alojamiento está a 1,8 km de Estación de metro Lambrate y dispone de wifi gratis en todo el alojamiento.

Este apartamento con aire acondicionado consta de 2 dormitorios, una sala de estar, una cocina totalmente equipada con nevera y cafetera, y 2 baños con bidet y ducha. Hay toallas y ropa de cama en el apartamento.

GAM Milano está a 2,1 km del alojamiento, y Villa Necchi Campiglio está a 2,4 km. El aeropuerto (Aeropuerto de Milán - Linate) está a 7 km."
749,Italianway - Meravigli 18,"8,4",3,Centro de Mil,0.6,1.566,"Italianway - Meravigli 18 ofrece wifi gratis y se encuentra en el centro de Milán, a 9 min a pie de Iglesia de Santa Maria delle Grazie y a 600 metros de Castillo Sforzesco. Este apartamento está a 10 min a pie de Piazza del Duomo y a 900 metros de Duomo Milan.

Este apartamento con aire acondicionado consta de 2 dormitorios, una sala de estar, una zona de cocina totalmente equipada con nevera y cafetera, y 1 baño con bidet y ducha. Hay toallas y ropa de cama en el apartamento.

Cerca del alojamiento hay puntos de interés como San Maurizio al Monastero Maggiore, La Scala y Galería Vittorio Emanuele. El aeropuerto (Aeropuerto de Milán - Linate) está a 10 km."
750,Suite Milano Duomo,"9,3",4,Centro de Mil,0.3,2.159,"El Suite Milano Duomo se encuentra a 150 metros de la catedral de Milán y ofrece conexión WiFi gratuita y habitaciones y apartamentos con aire acondicionado. Por las mañanas se sirve un desayuno con productos dulces en una cafetería cercana.

Tanto las habitaciones como los apartamentos tienen un baño de diseño con ducha. Los apartamentos también disponen de balcón y zona de cocina.

El Suite Milano Duomo está a 50 metros de la estación de metro Missori y a 10 minutos a pie de la ópera La Scala y de la famosa calle de tiendas de moda Via Montenapoleone."
751,Brera - Garibaldi Charme Apartment,"8,1",3,Centro de Mil,1.2,1.209,"Brera - Garibaldi Charme Apartment se encuentra en el centro de Milán, a 10 min a pie de Arena Civica y a 700 metros de Pinacoteca de Brera, y ofrece wifi gratis. Este apartamento está a 13 min a pie de Montenapoleone Metro Station y a 1,4 km de Piazza del Duomo.

Este apartamento con aire acondicionado consta de 1 dormitorio, una sala de estar, una cocina totalmente equipada con nevera y cafetera, y 1 baño con bidet y ducha. Hay toallas y ropa de cama en el apartamento.

Cerca del alojamiento hay puntos de interés como Castillo Sforzesco, La Scala y Galería Vittorio Emanuele. El aeropuerto (Aeropuerto de Milán - Linate) está a 10 km."
752,Charming Apartment in Historical Navigli Center,,,Navigli,2.0,1.153,"Charming Apartment in Historical Navigli Center está en Milán, a 15 min a pie de MUDEC y a 1 km de Dársena de Milán, y ofrece alojamiento con equipamiento como wifi gratis y TV de pantalla plana. Este apartamento está a 4 km de Iglesia de Santa Maria delle Grazie y a 4,1 km de San Maurizio al Monastero Maggiore.

Este apartamento con aire acondicionado ofrece acceso directo a un balcón y cuenta con 1 dormitorio y cocina totalmente equipada.

Palacio Real está a 4,2 km del alojamiento, y Museo Del Novecento está a 4,2 km. El aeropuerto (Aeropuerto de Milán - Linate) está a 10 km."
753,Bamboo Milano Rutilia,,4,Ripamonti Corvetto,2.7,927,"Bamboo Milano Rutilia, que tiene vistas al jardín, dispone de alojamiento con balcón y hervidor, y está a unos 2,7 km de Dársena de Milán. Este alojamiento con aire acondicionado está a 2 km de Porta Romana Metro Station y ofrece wifi gratis y parking privado en el propio alojamiento.

El apartamento ofrece una terraza y vistas a la ciudad e incluye 1 dormitorio, sala de estar, TV de pantalla plana por cable, cocina equipada y 1 baño con bidet y ducha. Hay toallas y ropa de cama en el apartamento.

Palacio Real está a 3,7 km del alojamiento, y Museo Del Novecento está a 3,7 km. El aeropuerto (Aeropuerto de Milán - Linate) está a 8 km."
754,"Caracciolo, 28 - Ampio per 5, posizione perfetta","9,0",3,Sempione,3.6,1.538,"Caracciolo, 28 - Ampio per 5, posizione perfetta se encuentra en el barrio de Sempione, en Milán, a 13 min a pie de Fiera Milano y a 1,6 km de CityLife, y ofrece alojamiento equipado con balcón y wifi gratis. Este apartamento está a 2,7 km de Arena Civica y a 3,7 km de Castillo Sforzesco.

Este apartamento con aire acondicionado consta de 2 dormitorios, una sala de estar, una cocina totalmente equipada con nevera y cafetera, y 1 baño con bidet y ducha. Hay toallas y ropa de cama en el apartamento.

Estadio San Siro está a 3,8 km del alojamiento, y Pinacoteca de Brera está a 3,8 km. El aeropuerto (Aeropuerto de Milán - Linate) está a 12 km."
755,milanofieracity,"9,5",3,Feria de Mil,3.4,1.588,"Milanofieracity está en el barrio de Feria de Milán, en Milán, y tiene aire acondicionado, balcón y vistas a la ciudad. Este apartamento ofrece wifi gratis y se encuentra a 13 min a pie de Fiera Milano y a 700 metros de CityLife.

Este apartamento tiene 1 dormitorio, cocina con nevera y lavavajillas, TV de pantalla plana, zona de estar y 1 baño con bidet. Hay toallas y ropa de cama en el apartamento.

Iglesia de Santa Maria delle Grazie está a 2,6 km del alojamiento, y Estadio San Siro está a 2,9 km. El aeropuerto más cercano (Aeropuerto de Milán - Linate) está a 13 km."
756,Prada House,"8,2",3,Ripamonti Corvetto,2.8,2.282,"Prada House es un alojamiento con jardín y terraza que se encuentra en Milán, a 1,7 km de Porta Romana Metro Station, a 3,4 km de Dársena de Milán y a 3,8 km de Palacio Real. Este apartamento ofrece parking privado gratis, recepción 24 horas y wifi gratis.

Este apartamento con aire acondicionado consta de 1 dormitorio, una sala de estar, una cocina totalmente equipada con nevera y cafetera, y 1 baño con bidet y artículos de aseo gratuitos. Hay toallas y ropa de cama en el apartamento.

Museo Del Novecento está a 3,8 km del alojamiento, y Estación de metro San Babila está a 4,6 km. El aeropuerto (Aeropuerto de Milán - Linate) está a 8 km."
757,QC&FUN Milan - San Siro Stadium,"9,4",4,San Siro,5.9,2.754,"QC&FUN Milan - San Siro Stadium, que tiene jardín y terraza, dispone de alojamiento en Milán con wifi gratis y vistas a la ciudad. Este apartamento está a 17 min a pie de Estadio San Siro y a 3,7 km de Fiera Milano.

Este apartamento con aire acondicionado consta de 1 dormitorio, una sala de estar, una cocina totalmente equipada con nevera y cafetera, y 1 baño con bidet y ducha. Hay toallas y ropa de cama en el apartamento.

CityLife está a 4,1 km del alojamiento, y Iglesia de Santa Maria delle Grazie está a 5,5 km. El aeropuerto (Aeropuerto de Milán - Linate) está a 15 km, y el alojamiento ofrece servicio de traslado de pago para ir o volver del aeropuerto."
758,Porta Nuova Bright and Roomy Flat,"9,1",3,Estaci,2.2,2.018,"Porta Nuova Bright and Roomy Flat se encuentra en el barrio de Central Station Area, en Milán, cerca de Estación de metro Centrale. Dispone de terraza, wifi gratis y lavadora. Este apartamento está a 2,3 km de Arena Civica y a 2,3 km de Villa Necchi Campiglio.

Este apartamento con aire acondicionado se compone de 2 dormitorios independientes, una cocina totalmente equipada con nevera y horno, y 2 baños. Hay toallas y ropa de cama en el apartamento.

Cerca del alojamiento hay puntos de interés como Bosco Verticale, GAM Milano y Pinacoteca de Brera. El aeropuerto (Aeropuerto de Milán - Linate) está a 9 km."
759,Easylife - Moderno bilocale a due passi dai Bastioni di Porta Venezia e dallo splendido parco cittadino Indro Montanelli,"7,8",3,Estaci,1.8,921,"Easylife - Moderno bilocale a due passi dai Bastioni di Porta Venezia e dallo splendido parco cittadino Indro Montanelli está en Milán, a 9 min a pie de GAM Milano y a 1 km de Villa Necchi Campiglio, y ofrece alojamiento con equipamiento como wifi gratis y TV. Este apartamento está a 13 min a pie de Estación de metro Centrale y a 2 km de Galería Vittorio Emanuele.

Este apartamento con aire acondicionado consta de 1 dormitorio y 1 baño con bidet, ducha y artículos de aseo gratuitos. El apartamento también incluye una cocina bien equipada con nevera, lavavajillas y horno, y también hay secador de pelo.

Cerca del alojamiento hay puntos de interés como Estación de metro San Babila, Montenapoleone Metro Station y Pinacoteca de Brera. El aeropuerto (Aeropuerto de Milán - Linate) está a 8 km."
760,"BnButler - Principe Eugenio - Casa Corsini, un Angolo Retrò","8,5",3,Sempione,3.4,1.205,"BnButler - Principe Eugenio - Casa Corsini, un Angolo Retrò está en el barrio de Sempione, en Milán, a 19 min a pie de Fiera Milano y a 1,8 km de CityLife, y ofrece alojamiento equipado con balcón y wifi gratis. Este apartamento está a 2,5 km de Arena Civica y a 3,3 km de Castillo Sforzesco.

Este apartamento de 2 dormitorios tiene aire acondicionado y ofrece 1 baño con bidet, ducha y secador de pelo. La cocina está equipada con nevera, horno y microondas, además de cafetera y hervidor.

Pinacoteca de Brera está a 3,4 km del alojamiento, y Bosco Verticale está a 3,7 km. El aeropuerto (Aeropuerto de Milán - Linate) está a 11 km."
761,Bilocale chic in Tropical VILLA a due passi da STAZIONE CENTRALE,"9,1",3,Bicocca ,3.0,1.051,"Bilocale chic in Tropical VILLA a due passi da STAZIONE CENTRALE, que cuenta con jardín, ofrece alojamiento en Milán con wifi gratis y vistas al jardín. Este apartamento está a 13 min a pie de Estación de metro Centrale y a 1,1 km de Bosco Verticale.

Este apartamento con aire acondicionado consta de 1 dormitorio, una sala de estar, una cocina totalmente equipada con nevera y cafetera, y 1 baño con bidet y ducha. Hay toallas y ropa de cama en el apartamento.

Arena Civica está a 3,4 km del alojamiento, y GAM Milano está a 3,4 km. El aeropuerto (Aeropuerto de Milán - Linate) está a 9 km."
762,Crossing Manzoni,"9,1",4,Centro de Mil,0.5,4.788,"Crossing Manzoni se encuentra a 5 min a pie de Galería Vittorio Emanuele, en Milán, y ofrece wifi gratis, servicio de conserjería y servicio de check-in y check-out exprés. Este alojamiento está muy cerca de lugares de interés como Piazza del Duomo, Duomo Milan y Duomo Metro Station. El alojamiento está a 4 min a pie de Montenapoleone Metro Station y a 400 metros del centro de la ciudad.

El hostal o pensión ofrece habitaciones con aire acondicionado, escritorio, hervidor, caja fuerte, TV de pantalla plana y baño privado con bidet. En Crossing Manzoni, todas las habitaciones tienen ropa de cama y toallas.

Cerca del alojamiento hay puntos de interés como Estación de metro San Babila, Pinacoteca de Brera y La Scala. El aeropuerto (Aeropuerto de Milán - Linate) está a 9 km."
